{
    "0": {
        "question": "Apa itu SWDKLLJ?",
        "answer": "SWDKLLJ adalah singkatan dari Sumbangan Wajib Dana Kecelakaan Lalu Lintas Jalan. \n\nSource: [36/PMK.010/2008](https://www.ojk.go.id/id/regulasi/Documents/Pages/PMK-Nomor-36PMK.010-Tahun-2008-tentang-Besar-Santunan-dan-Sumbangan-Wajib-Dana-Kecelakaan-Lalu-Lintas-Jalan/menas13_1389258036.pdf#page=2)",
        "contexts": [
            "wajib\nsebagaimana dimaksud dalam Undang-Undang Nomor 34 Tahun\n1964 tentang Dana Kecelakaan Lalu Lintas Jalan juncto Peraturan\nPelaksanaan Dana Kecelakaan Lalu Lintas Jalan.\n2) SWDKLLJ merupakan premi asuransi yang dibayarkan oleh para\npengusaha/pemilik alat angkutan lalu lintas jalan kepada\nperusahaan yang menyelenggarakan Dana Kecelakaan Lalu Lintas\nJalan.\nPasal 2\n(1 Korban kecelakaan alat angkutan lalu lintas jalan atau ahli warisnya\nberhak atas santunan.\nBesar santunan sebagaimana dimaksud pada ayat (1) ditentukan\nsebagai berikut:",
            "REPUBLIK INDONESIA\n Penyelenggaraan Usaha Perasuransian (Lembaran Negara Republik\nIndonesia Tahun 1992 Nomor 120, Tambahan Lembaran Negara\nRepublik Indonesia Nomor 3506) sebagaimana telah diubah dengan\nPeraturan Pemerintah Nomor 63 .Tahun 1999 (Lembaran Negara\nNegara Republik Indonesia Nomor 3861);\n Keputusan Presiden Nomor 20/P Tahun 2005j\n Keputusan Menteri Keuangan Nomor 337/KMK.011/1981 tentang\nPenunjukan Perusahaan Perseroan (Persero) Asuransi Kerugian Jasa\nRaharja untuk\n menyelenggarakan Dana Pertanggungan Wajib\nKecelakaan Penumpang dan Dana Kecelakaan Lalu Lintas Jalan;\nMEMUTUSKAN:\nMenetapkan : PERATURAN\nMENTERI\nKEUANGAN\nTENTANG\nBESAR\nLALU LINTAS JALAN\nPasal 1\n(1) Sumbangan Wajib Dana Kecelakaan Lalu Lintas Jalan,\nselanjutnya\n disebut SWDKLLJ, adalah sumbangan\nwajib\nsebagaimana dimaksud dalam Undang-Undang Nomor 34 Tahun\n1964 tentang Dana Kecelakaan Lalu Lintas Jalan juncto Peraturan\nPelaksanaan Dana Kecelakaan Lalu Lintas Jalan.",
            "MENTERI KEUANGAN\nREPUBLIK INDONESIA\nmemperoleh santunan sebesar Rp 25.000.000,00 (dua puluh lima\njuta rupiah).\nb. Korban yang mengalami cacat tetap berhak memperoleh\nsantunan yang besarnya dihitung berdasarkan angka prosentase\n Korban yang memerlukan perawatan dan pengobatan berhak\nrupiah).\nPasal 3\nDalam hal korban meninggal dunia akibat kecelakaan alat angkutan\nlalu lintas jalan tidak mempunyai ahli waris, kepada pihak yang\nmenyelenggarakan\ndiberikan\npenggantian\nbiaya\nPasal 4\n(2) Besar SWDKLLJ sebagaimana dimaksud pada ayat (1) ditentukan\nsebagai berikut:\nSepeda motor di bawah 50 cc, mobil ambulance, mobil jenazah\na.\ndan mobil pemadam kebakaran dibebaskan dari kewajiban\nb. Traktor, buidozer, forklift, mobil derek, excavator, crane dan\nsejenisnya sebesar Rp 20.000,00 (dua puluh ribu rupiah):\n Sepeda motor, sepeda kumbang dan scooter di atas 50 cc sampai\n250 cc dan kendaraan bermotor roda tiga sebesar Rp 32.000,00\n(tiga puluh dua ribu rupiah).\nd.",
            "2) Dalam hal pembayaran SWDKLLJ dilakukan setelah melewati batas\n seharusnya dibayar dengan ketentuan denda yang dikenakan paling\nbesar Rp100.000,00 (seratus ribu rupiah).\n(3) Dalam hal ketentuan mengenai batas waktu sebagaimana dimaksud\ngeografis daerah setempat, Direksi perusahaan yang ditunjuk untuk\nmenyelenggarakan Dana Kecelakaan Lalu Lintas Jalan diberi\nbesarnya denda SWDKLLJ, dengan ketentuan batas waktu dimaksud\npaling lama 15 (lima belas) hari kerja.",
            "MENTERI KEUANGAN\nREPUBLIK INDONESIA\nPasal 7\nDalam hal Pemerintah Daerah melakukan pembebasan terhadap Pajak\nperusahaan yang ditunjuk untuk menyelenggarakan Dana Kecelakaan\nLalu Lintas Jalan dapat menetapkan kebijakan pembebasan pembayaran\nSWDKLLJ, Kartu Dana/Sertifikat, dan besar denda SWDKLLJ yang\ntertunggak untuk tahun yang lewat, dengan mempertimbangkan\nkebijakan Pemerintah Daerah setempat.\nPasal 8\nPada saat Peraturan Menteri Keuangan ini mulai berlaku, Keputusan\nMenteri Keuangan Nomor 416/KMK.06/2001 tentang Penetapan\nSantunan dan Sumbangan Wajib Dana Kecelakaan Lalu Lintas Jalan,\ndicabut dan dinyatakan tidak berlaku.\nPasal 9\nPeraturan Menteri Keuangan ini mulai berlaku setelah 30 (tiga puluh\nhari sejak tanggal ditetapkan.\nPeraturan Menteri Keuangan ini dengan penempatannya dalam Berita\nNegara Republik Indonesia.\nDitetapkan di Jakarta\npada tanggal 26 Februari 2008\nMENTERI KEUANGAN\nttd\nSalinan sesuai dengan aslinya\nSRI MULYANI INDRAWATI\nn Tata Usaha Departemen",
            "Pensiun Syariah, baik DPPK maupun DPLK. \nSelanjutnya, ketentuan terkait persyaratan pendirian Dana Pensiun yang \nmenyelenggarakan program pensiun berdasarkan prinsip syariah, saat ini \nmengikuti ketentuan yang ada di dalam POJK Nomor 33/POJK.05/2016 \ntentang Penyelenggaraan Program Pensiun Berdasarkan Prinsip Syariah \n(POJK 33/2016). \n \n10. \nApakah yang dimaksud prinsip syariah pada penyelenggaraan program \npensiun di Dana Pensiun?  \nPasal 134 angka 20 UU PPSK mengatur bahwa prinsip syariah adalah \nprinsip hukum Islam berdasarkan fatwa dan/atau pernyataan kesesuaian \nsyariah yang dikeluarkan oleh lembaga yang memiliki kewenangan dalam \npenetapan fatwa di bidang syariah."
        ],
        "ground_truth": "Sumbangan Wajib Dana Kecelakaan Lalu Lintas adalah sumbangan wajib sebagaimana dimaksud dalam Undang-Undang Nomor 34 Tahun 1964 tentang Dana Kecelakaan Lalu Lintas Jalan juncto Peraturan Pemerintah Nomor 18 Tahun 1965 tentang Ketentuan-Ketentuan Pelaksanaan Dana Kecelakaan Lalu Lintas Jalan.",
        "faithfulness": 1.0,
        "answer_relevancy": 0.9542825391531932,
        "context_precision": 0.8874999999778125,
        "context_recall": 1.0,
        "answer_similarity": 0.9143513978265925,
        "answer_correctness": 0.6035835412416117,
        "harmfulness": 0
    },
    "1": {
        "question": "Dipungut dari mana?",
        "answer": "SWDKLLJ dipungut dari para pengusaha/pemilik alat angkutan lalu lintas jalan.\n\nSource: [36/PMK.010/2008](https://www.ojk.go.id/id/regulasi/Documents/Pages/PMK-Nomor-36PMK.010-Tahun-2008-tentang-Besar-Santunan-dan-Sumbangan-Wajib-Dana-Kecelakaan-Lalu-Lintas-Jalan/menas13_1389258036.pdf#page=2)",
        "contexts": [
            "wajib\nsebagaimana dimaksud dalam Undang-Undang Nomor 34 Tahun\n1964 tentang Dana Kecelakaan Lalu Lintas Jalan juncto Peraturan\nPelaksanaan Dana Kecelakaan Lalu Lintas Jalan.\n2) SWDKLLJ merupakan premi asuransi yang dibayarkan oleh para\npengusaha/pemilik alat angkutan lalu lintas jalan kepada\nperusahaan yang menyelenggarakan Dana Kecelakaan Lalu Lintas\nJalan.\nPasal 2\n(1 Korban kecelakaan alat angkutan lalu lintas jalan atau ahli warisnya\nberhak atas santunan.\nBesar santunan sebagaimana dimaksud pada ayat (1) ditentukan\nsebagai berikut:",
            "REPUBLIK INDONESIA\n Penyelenggaraan Usaha Perasuransian (Lembaran Negara Republik\nIndonesia Tahun 1992 Nomor 120, Tambahan Lembaran Negara\nRepublik Indonesia Nomor 3506) sebagaimana telah diubah dengan\nPeraturan Pemerintah Nomor 63 .Tahun 1999 (Lembaran Negara\nNegara Republik Indonesia Nomor 3861);\n Keputusan Presiden Nomor 20/P Tahun 2005j\n Keputusan Menteri Keuangan Nomor 337/KMK.011/1981 tentang\nPenunjukan Perusahaan Perseroan (Persero) Asuransi Kerugian Jasa\nRaharja untuk\n menyelenggarakan Dana Pertanggungan Wajib\nKecelakaan Penumpang dan Dana Kecelakaan Lalu Lintas Jalan;\nMEMUTUSKAN:\nMenetapkan : PERATURAN\nMENTERI\nKEUANGAN\nTENTANG\nBESAR\nLALU LINTAS JALAN\nPasal 1\n(1) Sumbangan Wajib Dana Kecelakaan Lalu Lintas Jalan,\nselanjutnya\n disebut SWDKLLJ, adalah sumbangan\nwajib\nsebagaimana dimaksud dalam Undang-Undang Nomor 34 Tahun\n1964 tentang Dana Kecelakaan Lalu Lintas Jalan juncto Peraturan\nPelaksanaan Dana Kecelakaan Lalu Lintas Jalan.",
            "MENTERI KEUANGAN\nREPUBLIK INDONESIA\nmemperoleh santunan sebesar Rp 25.000.000,00 (dua puluh lima\njuta rupiah).\nb. Korban yang mengalami cacat tetap berhak memperoleh\nsantunan yang besarnya dihitung berdasarkan angka prosentase\n Korban yang memerlukan perawatan dan pengobatan berhak\nrupiah).\nPasal 3\nDalam hal korban meninggal dunia akibat kecelakaan alat angkutan\nlalu lintas jalan tidak mempunyai ahli waris, kepada pihak yang\nmenyelenggarakan\ndiberikan\npenggantian\nbiaya\nPasal 4\n(2) Besar SWDKLLJ sebagaimana dimaksud pada ayat (1) ditentukan\nsebagai berikut:\nSepeda motor di bawah 50 cc, mobil ambulance, mobil jenazah\na.\ndan mobil pemadam kebakaran dibebaskan dari kewajiban\nb. Traktor, buidozer, forklift, mobil derek, excavator, crane dan\nsejenisnya sebesar Rp 20.000,00 (dua puluh ribu rupiah):\n Sepeda motor, sepeda kumbang dan scooter di atas 50 cc sampai\n250 cc dan kendaraan bermotor roda tiga sebesar Rp 32.000,00\n(tiga puluh dua ribu rupiah).\nd.",
            "2) Dalam hal pembayaran SWDKLLJ dilakukan setelah melewati batas\n seharusnya dibayar dengan ketentuan denda yang dikenakan paling\nbesar Rp100.000,00 (seratus ribu rupiah).\n(3) Dalam hal ketentuan mengenai batas waktu sebagaimana dimaksud\ngeografis daerah setempat, Direksi perusahaan yang ditunjuk untuk\nmenyelenggarakan Dana Kecelakaan Lalu Lintas Jalan diberi\nbesarnya denda SWDKLLJ, dengan ketentuan batas waktu dimaksud\npaling lama 15 (lima belas) hari kerja.",
            "MENTERI KEUANGAN\nREPUBLIK INDONESIA\nPasal 7\nDalam hal Pemerintah Daerah melakukan pembebasan terhadap Pajak\nperusahaan yang ditunjuk untuk menyelenggarakan Dana Kecelakaan\nLalu Lintas Jalan dapat menetapkan kebijakan pembebasan pembayaran\nSWDKLLJ, Kartu Dana/Sertifikat, dan besar denda SWDKLLJ yang\ntertunggak untuk tahun yang lewat, dengan mempertimbangkan\nkebijakan Pemerintah Daerah setempat.\nPasal 8\nPada saat Peraturan Menteri Keuangan ini mulai berlaku, Keputusan\nMenteri Keuangan Nomor 416/KMK.06/2001 tentang Penetapan\nSantunan dan Sumbangan Wajib Dana Kecelakaan Lalu Lintas Jalan,\ndicabut dan dinyatakan tidak berlaku.\nPasal 9\nPeraturan Menteri Keuangan ini mulai berlaku setelah 30 (tiga puluh\nhari sejak tanggal ditetapkan.\nPeraturan Menteri Keuangan ini dengan penempatannya dalam Berita\nNegara Republik Indonesia.\nDitetapkan di Jakarta\npada tanggal 26 Februari 2008\nMENTERI KEUANGAN\nttd\nSalinan sesuai dengan aslinya\nSRI MULYANI INDRAWATI\nn Tata Usaha Departemen",
            "MENTERI KEUANGAN\nREPUBLIK INDONESIA\n-4-\n Mobil penumpang angkutan umum sampai dengan 1600 cc\ng. Bus dan mikro bus bukan angkutan umum sebesar Rp150.000,00\n(seratus lima puluh ribu rupiah).\nh. Bus dan.mikro bus angkutan umum, serta mobil penumpang\nangkutan umum lainnya di atas 1600 cc sebesar Rp87.000,00\n(delapan puluh tujuh ribu rupiah).\nTruk, mobil tangki, mobil gandengan, mobil barang di atas 2400\ncc, truk container dan sejenisnya sebesar Rp 160.000,00 (seratus\n enam puluh ribu rupiah).\nPasal 5\nSetiap jenis kendaraan sebagaimana dimaksud dalam Pasal 4, dikenakan\nbiaya\n penggantian pembuatan\n Kartu Dana/Sertifikat sebesar\nRp 3.000,00 (tiga ribu rupiah).\nPasal 6\nTanda Nomor Kendaraan Bermotor sesuai dengan ketentuan\nperaturan perundang-undangan yang berlaku.\n2) Dalam hal pembayaran SWDKLLJ dilakukan setelah melewati batas\n seharusnya dibayar dengan ketentuan denda yang dikenakan paling\nbesar Rp100.000,00 (seratus ribu rupiah)."
        ],
        "ground_truth": "SWDKLLJ dipungut dari para pengusaha/pemilik angkutan lalu lintas jalan.",
        "faithfulness": 1.0,
        "answer_relevancy": 0.772913464766208,
        "context_precision": 0.9999999999666667,
        "context_recall": 1.0,
        "answer_similarity": 0.955766493166407,
        "answer_correctness": 0.9889416232916017,
        "harmfulness": 0
    },
    "2": {
        "question": "Berapa yang dipungut untuk sepeda motor di bawah 50cc?",
        "answer": "Besar santunan yang dipungut untuk sepeda motor di bawah 50cc adalah Rp 20.000,00 (dua puluh ribu rupiah).\n\nSource: [36/PMK.010/2008](https://www.ojk.go.id/id/regulasi/Documents/Pages/PMK-Nomor-36PMK.010-Tahun-2008-tentang-Besar-Santunan-dan-Sumbangan-Wajib-Dana-Kecelakaan-Lalu-Lintas-Jalan/menas13_1389258036.pdf#page=4)",
        "contexts": [
            "MENTERI KEUANGAN\nREPUBLIK INDONESIA\nmemperoleh santunan sebesar Rp 25.000.000,00 (dua puluh lima\njuta rupiah).\nb. Korban yang mengalami cacat tetap berhak memperoleh\nsantunan yang besarnya dihitung berdasarkan angka prosentase\n Korban yang memerlukan perawatan dan pengobatan berhak\nrupiah).\nPasal 3\nDalam hal korban meninggal dunia akibat kecelakaan alat angkutan\nlalu lintas jalan tidak mempunyai ahli waris, kepada pihak yang\nmenyelenggarakan\ndiberikan\npenggantian\nbiaya\nPasal 4\n(2) Besar SWDKLLJ sebagaimana dimaksud pada ayat (1) ditentukan\nsebagai berikut:\nSepeda motor di bawah 50 cc, mobil ambulance, mobil jenazah\na.\ndan mobil pemadam kebakaran dibebaskan dari kewajiban\nb. Traktor, buidozer, forklift, mobil derek, excavator, crane dan\nsejenisnya sebesar Rp 20.000,00 (dua puluh ribu rupiah):\n Sepeda motor, sepeda kumbang dan scooter di atas 50 cc sampai\n250 cc dan kendaraan bermotor roda tiga sebesar Rp 32.000,00\n(tiga puluh dua ribu rupiah).\nd.",
            "Sepeda motor, sepeda kumbang dan scooter di atas 50 cc sampai\n250 cc dan kendaraan bermotor roda tiga sebesar Rp 32.000,00\n(tiga puluh dua ribu rupiah).\nd.\nPick up/mobil barang sampai dengan 2400 cc, sedan, jeep dan\n mobil penumpang bukan angkutan umum sebesar Rp140.000,00\n(seratus empat puluh ribu rupiah).",
            "c. piutang lebih dari Rp50.000.000.000,00 (lima puluh \nmiliar rupiah) oleh Menteri. \n(2) Piutang yang dapat dihapusbukukan adalah piutang \nmacet \nyang \nwalaupun \ntelah \ndilakukan \nupaya \nrestrukturisasi, tetap tidak tertagih dan tidak disebabkan \noleh adanya kesalahan dalam penyalurannya. \n(3) LPEI wajib terus melakukan upaya penagihan atas \npiutang yang telah dihapusbukukan sebelum piutang \ntersebut dihapus tagih. \n \n          Pasal 33 . . .",
            "MENTERI KEUANGAN\nREPUBLIK INDONESIA\n-4-\n Mobil penumpang angkutan umum sampai dengan 1600 cc\ng. Bus dan mikro bus bukan angkutan umum sebesar Rp150.000,00\n(seratus lima puluh ribu rupiah).\nh. Bus dan.mikro bus angkutan umum, serta mobil penumpang\nangkutan umum lainnya di atas 1600 cc sebesar Rp87.000,00\n(delapan puluh tujuh ribu rupiah).\nTruk, mobil tangki, mobil gandengan, mobil barang di atas 2400\ncc, truk container dan sejenisnya sebesar Rp 160.000,00 (seratus\n enam puluh ribu rupiah).\nPasal 5\nSetiap jenis kendaraan sebagaimana dimaksud dalam Pasal 4, dikenakan\nbiaya\n penggantian pembuatan\n Kartu Dana/Sertifikat sebesar\nRp 3.000,00 (tiga ribu rupiah).\nPasal 6\nTanda Nomor Kendaraan Bermotor sesuai dengan ketentuan\nperaturan perundang-undangan yang berlaku.\n2) Dalam hal pembayaran SWDKLLJ dilakukan setelah melewati batas\n seharusnya dibayar dengan ketentuan denda yang dikenakan paling\nbesar Rp100.000,00 (seratus ribu rupiah).",
            "berumur sampai dengan 3 (tiga) tahun. Untuk kendaraan berumur lebih dari    \n3 (tiga) tahun, harus dikenakan premi tambahan yang wajar. \n2. Untuk perluasan Strike, Riot, Civil Commotion (SRCC), Flood, Earthquake, dan \nThird Party Liability (TPL) harus dikenakan premi tambahan. \n3. Unsur premi murni di atas merupakan persentase dari uang pertanggungan. \n4. Deductible minimum sebesar Rp200.000,00 (dua ratus ribu rupiah). \n5. Premi murni paling sedikit 50% (lima puluh per seratus) dari premi bruto.  \nII. PREMI YANG DIBEBANKAN PADA TERTANGGUNG \nPremi yang dibebankan pada tertanggung adalah premi murni ditambah biaya \nadministrasi dan umum, biaya akuisisi, dan keuntungan perusahaan.",
            "keterlambatan penyampaian laporan dimaksud dengan ketentuan bahwa jumlah\n    \nkeseluruhan denda paling banyak Rp100.000.000,00 (seratus juta rupiah).\nPasal 64\n(1)\nSanksi denda, selain sanksi denda sebagaimana dimaksud dalam Pasal 63, dapat\n    \ndikenakan pada Pihak sebagaimana dimaksud dalam Pasal 61 paling banyak\n     \nRp100.000.000,00 (seratus juta rupiah) bagi orang perseorangan dan paling banyak\n   \nRp500.000.000,00 (lima ratus juta rupiah) bagi Pihak yang bukan orang\nperseorangan, yang melanggar peraturan perundang-undangan di bidang\n     \nPasar Modal.\n(2)\nKetentuan lebih lanjut mengenai pengenaan sanksi denda sebagaimana dimaksud dalam\nayat (1) ditetapkan oleh Bapepam.\nPasal 65\n(1)\nSanksi denda sebagaimana dimaksud dalam Pasal 63 dan Pasal 64 dikenakan untuk\n \nsetiap pelanggaran terhadap peraturan perundang-undangan di bidang Pasar Modal.\n(2)\nPengenaan sanksi administratif sebagaimana dimaksud dalam Pasal 61 dapat diumumkan\ndalam media massa oleh Bapepam."
        ],
        "ground_truth": "Sepeda motor di bawah 50cc, mobil ambulance, mobil jenazah, dan mobil pemadam kebakaran dibebaskan dari kewajiban membayar SWDKLLJ.",
        "faithfulness": 1.0,
        "answer_relevancy": 0.966288778791858,
        "context_precision": 0.9999999999,
        "context_recall": 1.0,
        "answer_similarity": 0.8659276470052593,
        "answer_correctness": 0.21648191175131482,
        "harmfulness": 0
    },
    "3": {
        "question": "Kalau traktor?",
        "answer": "Besar santunan yang dipungut untuk traktor sebesar Rp 20.000,00 (dua puluh ribu rupiah).\n\nSource: [36/PMK.010/2008](https://www.ojk.go.id/id/regulasi/Documents/Pages/PMK-Nomor-36PMK.010-Tahun-2008-tentang-Besar-Santunan-dan-Sumbangan-Wajib-Dana-Kecelakaan-Lalu-Lintas-Jalan/menas13_1389258036.pdf#page=3.0)",
        "contexts": [
            "MENTERI KEUANGAN\nREPUBLIK INDONESIA\nmemperoleh santunan sebesar Rp 25.000.000,00 (dua puluh lima\njuta rupiah).\nb. Korban yang mengalami cacat tetap berhak memperoleh\nsantunan yang besarnya dihitung berdasarkan angka prosentase\n Korban yang memerlukan perawatan dan pengobatan berhak\nrupiah).\nPasal 3\nDalam hal korban meninggal dunia akibat kecelakaan alat angkutan\nlalu lintas jalan tidak mempunyai ahli waris, kepada pihak yang\nmenyelenggarakan\ndiberikan\npenggantian\nbiaya\nPasal 4\n(2) Besar SWDKLLJ sebagaimana dimaksud pada ayat (1) ditentukan\nsebagai berikut:\nSepeda motor di bawah 50 cc, mobil ambulance, mobil jenazah\na.\ndan mobil pemadam kebakaran dibebaskan dari kewajiban\nb. Traktor, buidozer, forklift, mobil derek, excavator, crane dan\nsejenisnya sebesar Rp 20.000,00 (dua puluh ribu rupiah):\n Sepeda motor, sepeda kumbang dan scooter di atas 50 cc sampai\n250 cc dan kendaraan bermotor roda tiga sebesar Rp 32.000,00\n(tiga puluh dua ribu rupiah).\nd.",
            "\u2022 T \n= \ntarif premi \nMasa pertanggungan untuk masing-masing jenis angkutan ditentukan \nsebagai berikut: \nJenis Angkutan \nMasa Pertanggungan \nKendaraan Bermotor  \n2  hari \nKereta Api \n1  hari \nKapal Laut \n2  hari \nPesawat Udara \n1  hari",
            "hutang kepada negara yang harus dicantumkan dalam neraca pcrusahaan yang \nbersangkutan. \n \nPasal 40 \n \nPerusahaan Perasuransian yang telah dikenakan denda selama 90 (sembilan puluh) hari \nketerlambatan tetapi belum juga menyampaikan laporan sebagaimana dimaksud dalam Pasal 38, \ndengan tidak membebaskan kewajiban membayar denda yang telah dikenakan untuk jangka 90 \n(sembilan puluh) hari termaksud, dikenakan sanksi pembatasan kegiatan usaha.",
            "tanah dan/atau bangunan\n50% dari nilai AYDA apabila dimiliki lebih dari 1 s.d. 3 tahun;\n75% dari nilai AYDA apabila dimiliki lebih dari 3 s.d. 5 tahun; dan/atau\n100% dari nilai AYDA apabila dimiliki lebih dari 5 tahun.\nkendaraan bermotor, kapal, perahu bermotor, alat berat, dan/atau mesin\n50% dari nilai AYDA apabila dimiliki lebih dari 1 s.d. 2 tahun; dan/atau\n100% dari nilai AYDA apabila dimiliki lebih dari 2 tahun.\nHapus buku dan/atau hapus tagih hanya dapat dilakukan terhadap penyediaan dana yang memiliki kualitas macet.",
            "Sepeda motor, sepeda kumbang dan scooter di atas 50 cc sampai\n250 cc dan kendaraan bermotor roda tiga sebesar Rp 32.000,00\n(tiga puluh dua ribu rupiah).\nd.\nPick up/mobil barang sampai dengan 2400 cc, sedan, jeep dan\n mobil penumpang bukan angkutan umum sebesar Rp140.000,00\n(seratus empat puluh ribu rupiah).",
            "berumur sampai dengan 3 (tiga) tahun. Untuk kendaraan berumur lebih dari    \n3 (tiga) tahun, harus dikenakan premi tambahan yang wajar. \n2. Untuk perluasan Strike, Riot, Civil Commotion (SRCC), Flood, Earthquake, dan \nThird Party Liability (TPL) harus dikenakan premi tambahan. \n3. Unsur premi murni di atas merupakan persentase dari uang pertanggungan. \n4. Deductible minimum sebesar Rp200.000,00 (dua ratus ribu rupiah). \n5. Premi murni paling sedikit 50% (lima puluh per seratus) dari premi bruto.  \nII. PREMI YANG DIBEBANKAN PADA TERTANGGUNG \nPremi yang dibebankan pada tertanggung adalah premi murni ditambah biaya \nadministrasi dan umum, biaya akuisisi, dan keuntungan perusahaan."
        ],
        "ground_truth": "Traktor, buldozer, forklift, mobil derek, excavator, crane dan sejenisnya sebesar Rp 20.000,00 (dua puluh ribu rupiah).",
        "faithfulness": 1.0,
        "answer_relevancy": 0.8827038943293742,
        "context_precision": 0.699999999965,
        "context_recall": 1.0,
        "answer_similarity": 0.8826537064305513,
        "answer_correctness": 0.22066342660763782,
        "harmfulness": 0
    },
    "4": {
        "question": "Kendaraan apa yang memiliki SWDKLLJ terbesar?",
        "answer": "Kendaraan yang memiliki SWDKLLJ terbesar adalah truk, mobil tangki, mobil gandengan, mobil barang di atas 2400 cc, truk container dan sejenisnya.\n\nSource: [36/PMK.010/2008](https://www.ojk.go.id/id/regulasi/Documents/Pages/PMK-Nomor-36PMK.010-Tahun-2008-tentang-Besar-Santunan-dan-Sumbangan-Wajib-Dana-Kecelakaan-Lalu-Lintas-Jalan/menas13_1389258036.pdf#page=4)",
        "contexts": [
            "MENTERI KEUANGAN\nREPUBLIK INDONESIA\nmemperoleh santunan sebesar Rp 25.000.000,00 (dua puluh lima\njuta rupiah).\nb. Korban yang mengalami cacat tetap berhak memperoleh\nsantunan yang besarnya dihitung berdasarkan angka prosentase\n Korban yang memerlukan perawatan dan pengobatan berhak\nrupiah).\nPasal 3\nDalam hal korban meninggal dunia akibat kecelakaan alat angkutan\nlalu lintas jalan tidak mempunyai ahli waris, kepada pihak yang\nmenyelenggarakan\ndiberikan\npenggantian\nbiaya\nPasal 4\n(2) Besar SWDKLLJ sebagaimana dimaksud pada ayat (1) ditentukan\nsebagai berikut:\nSepeda motor di bawah 50 cc, mobil ambulance, mobil jenazah\na.\ndan mobil pemadam kebakaran dibebaskan dari kewajiban\nb. Traktor, buidozer, forklift, mobil derek, excavator, crane dan\nsejenisnya sebesar Rp 20.000,00 (dua puluh ribu rupiah):\n Sepeda motor, sepeda kumbang dan scooter di atas 50 cc sampai\n250 cc dan kendaraan bermotor roda tiga sebesar Rp 32.000,00\n(tiga puluh dua ribu rupiah).\nd.",
            "wajib\nsebagaimana dimaksud dalam Undang-Undang Nomor 34 Tahun\n1964 tentang Dana Kecelakaan Lalu Lintas Jalan juncto Peraturan\nPelaksanaan Dana Kecelakaan Lalu Lintas Jalan.\n2) SWDKLLJ merupakan premi asuransi yang dibayarkan oleh para\npengusaha/pemilik alat angkutan lalu lintas jalan kepada\nperusahaan yang menyelenggarakan Dana Kecelakaan Lalu Lintas\nJalan.\nPasal 2\n(1 Korban kecelakaan alat angkutan lalu lintas jalan atau ahli warisnya\nberhak atas santunan.\nBesar santunan sebagaimana dimaksud pada ayat (1) ditentukan\nsebagai berikut:",
            "2) Dalam hal pembayaran SWDKLLJ dilakukan setelah melewati batas\n seharusnya dibayar dengan ketentuan denda yang dikenakan paling\nbesar Rp100.000,00 (seratus ribu rupiah).\n(3) Dalam hal ketentuan mengenai batas waktu sebagaimana dimaksud\ngeografis daerah setempat, Direksi perusahaan yang ditunjuk untuk\nmenyelenggarakan Dana Kecelakaan Lalu Lintas Jalan diberi\nbesarnya denda SWDKLLJ, dengan ketentuan batas waktu dimaksud\npaling lama 15 (lima belas) hari kerja.",
            "MENTERI KEUANGAN\nREPUBLIK INDONESIA\n-4-\n Mobil penumpang angkutan umum sampai dengan 1600 cc\ng. Bus dan mikro bus bukan angkutan umum sebesar Rp150.000,00\n(seratus lima puluh ribu rupiah).\nh. Bus dan.mikro bus angkutan umum, serta mobil penumpang\nangkutan umum lainnya di atas 1600 cc sebesar Rp87.000,00\n(delapan puluh tujuh ribu rupiah).\nTruk, mobil tangki, mobil gandengan, mobil barang di atas 2400\ncc, truk container dan sejenisnya sebesar Rp 160.000,00 (seratus\n enam puluh ribu rupiah).\nPasal 5\nSetiap jenis kendaraan sebagaimana dimaksud dalam Pasal 4, dikenakan\nbiaya\n penggantian pembuatan\n Kartu Dana/Sertifikat sebesar\nRp 3.000,00 (tiga ribu rupiah).\nPasal 6\nTanda Nomor Kendaraan Bermotor sesuai dengan ketentuan\nperaturan perundang-undangan yang berlaku.\n2) Dalam hal pembayaran SWDKLLJ dilakukan setelah melewati batas\n seharusnya dibayar dengan ketentuan denda yang dikenakan paling\nbesar Rp100.000,00 (seratus ribu rupiah).",
            "REPUBLIK INDONESIA\n Penyelenggaraan Usaha Perasuransian (Lembaran Negara Republik\nIndonesia Tahun 1992 Nomor 120, Tambahan Lembaran Negara\nRepublik Indonesia Nomor 3506) sebagaimana telah diubah dengan\nPeraturan Pemerintah Nomor 63 .Tahun 1999 (Lembaran Negara\nNegara Republik Indonesia Nomor 3861);\n Keputusan Presiden Nomor 20/P Tahun 2005j\n Keputusan Menteri Keuangan Nomor 337/KMK.011/1981 tentang\nPenunjukan Perusahaan Perseroan (Persero) Asuransi Kerugian Jasa\nRaharja untuk\n menyelenggarakan Dana Pertanggungan Wajib\nKecelakaan Penumpang dan Dana Kecelakaan Lalu Lintas Jalan;\nMEMUTUSKAN:\nMenetapkan : PERATURAN\nMENTERI\nKEUANGAN\nTENTANG\nBESAR\nLALU LINTAS JALAN\nPasal 1\n(1) Sumbangan Wajib Dana Kecelakaan Lalu Lintas Jalan,\nselanjutnya\n disebut SWDKLLJ, adalah sumbangan\nwajib\nsebagaimana dimaksud dalam Undang-Undang Nomor 34 Tahun\n1964 tentang Dana Kecelakaan Lalu Lintas Jalan juncto Peraturan\nPelaksanaan Dana Kecelakaan Lalu Lintas Jalan.",
            "Sepeda motor, sepeda kumbang dan scooter di atas 50 cc sampai\n250 cc dan kendaraan bermotor roda tiga sebesar Rp 32.000,00\n(tiga puluh dua ribu rupiah).\nd.\nPick up/mobil barang sampai dengan 2400 cc, sedan, jeep dan\n mobil penumpang bukan angkutan umum sebesar Rp140.000,00\n(seratus empat puluh ribu rupiah)."
        ],
        "ground_truth": "Truk, mobil tangki, mobil gandengan, mobil barang di atas 2400 cc, truk container dan sejenisnya.",
        "faithfulness": 0.2,
        "answer_relevancy": 0.9963704046796341,
        "context_precision": 0.8874999999778125,
        "context_recall": 1.0,
        "answer_similarity": 0.8982071139062714,
        "answer_correctness": 0.9745517784765678,
        "harmfulness": 0
    },
    "5": {
        "question": "Berapa nilainya?",
        "answer": "Besar SWDKLLJ untuk kendaraan truk, mobil tangki, mobil gandengan, mobil barang di atas 2400 cc, truk container, dan sejenisnya adalah Rp 160.000,00 (seratus enam puluh ribu rupiah).\n\nSource: [36/PMK.010/2008](https://www.ojk.go.id/id/regulasi/Documents/Pages/PMK-Nomor-36PMK.010-Tahun-2008-tentang-Besar-Santunan-dan-Sumbangan-Wajib-Dana-Kecelakaan-Lalu-Lintas-Jalan/menas13_1389258036.pdf#page=4.0)",
        "contexts": [
            "MENTERI KEUANGAN\nREPUBLIK INDONESIA\n-4-\n Mobil penumpang angkutan umum sampai dengan 1600 cc\ng. Bus dan mikro bus bukan angkutan umum sebesar Rp150.000,00\n(seratus lima puluh ribu rupiah).\nh. Bus dan.mikro bus angkutan umum, serta mobil penumpang\nangkutan umum lainnya di atas 1600 cc sebesar Rp87.000,00\n(delapan puluh tujuh ribu rupiah).\nTruk, mobil tangki, mobil gandengan, mobil barang di atas 2400\ncc, truk container dan sejenisnya sebesar Rp 160.000,00 (seratus\n enam puluh ribu rupiah).\nPasal 5\nSetiap jenis kendaraan sebagaimana dimaksud dalam Pasal 4, dikenakan\nbiaya\n penggantian pembuatan\n Kartu Dana/Sertifikat sebesar\nRp 3.000,00 (tiga ribu rupiah).\nPasal 6\nTanda Nomor Kendaraan Bermotor sesuai dengan ketentuan\nperaturan perundang-undangan yang berlaku.\n2) Dalam hal pembayaran SWDKLLJ dilakukan setelah melewati batas\n seharusnya dibayar dengan ketentuan denda yang dikenakan paling\nbesar Rp100.000,00 (seratus ribu rupiah).",
            "MENTERI KEUANGAN\nREPUBLIK INDONESIA\nmemperoleh santunan sebesar Rp 25.000.000,00 (dua puluh lima\njuta rupiah).\nb. Korban yang mengalami cacat tetap berhak memperoleh\nsantunan yang besarnya dihitung berdasarkan angka prosentase\n Korban yang memerlukan perawatan dan pengobatan berhak\nrupiah).\nPasal 3\nDalam hal korban meninggal dunia akibat kecelakaan alat angkutan\nlalu lintas jalan tidak mempunyai ahli waris, kepada pihak yang\nmenyelenggarakan\ndiberikan\npenggantian\nbiaya\nPasal 4\n(2) Besar SWDKLLJ sebagaimana dimaksud pada ayat (1) ditentukan\nsebagai berikut:\nSepeda motor di bawah 50 cc, mobil ambulance, mobil jenazah\na.\ndan mobil pemadam kebakaran dibebaskan dari kewajiban\nb. Traktor, buidozer, forklift, mobil derek, excavator, crane dan\nsejenisnya sebesar Rp 20.000,00 (dua puluh ribu rupiah):\n Sepeda motor, sepeda kumbang dan scooter di atas 50 cc sampai\n250 cc dan kendaraan bermotor roda tiga sebesar Rp 32.000,00\n(tiga puluh dua ribu rupiah).\nd.",
            "2) Dalam hal pembayaran SWDKLLJ dilakukan setelah melewati batas\n seharusnya dibayar dengan ketentuan denda yang dikenakan paling\nbesar Rp100.000,00 (seratus ribu rupiah).\n(3) Dalam hal ketentuan mengenai batas waktu sebagaimana dimaksud\ngeografis daerah setempat, Direksi perusahaan yang ditunjuk untuk\nmenyelenggarakan Dana Kecelakaan Lalu Lintas Jalan diberi\nbesarnya denda SWDKLLJ, dengan ketentuan batas waktu dimaksud\npaling lama 15 (lima belas) hari kerja.",
            "wajib\nsebagaimana dimaksud dalam Undang-Undang Nomor 34 Tahun\n1964 tentang Dana Kecelakaan Lalu Lintas Jalan juncto Peraturan\nPelaksanaan Dana Kecelakaan Lalu Lintas Jalan.\n2) SWDKLLJ merupakan premi asuransi yang dibayarkan oleh para\npengusaha/pemilik alat angkutan lalu lintas jalan kepada\nperusahaan yang menyelenggarakan Dana Kecelakaan Lalu Lintas\nJalan.\nPasal 2\n(1 Korban kecelakaan alat angkutan lalu lintas jalan atau ahli warisnya\nberhak atas santunan.\nBesar santunan sebagaimana dimaksud pada ayat (1) ditentukan\nsebagai berikut:",
            "REPUBLIK INDONESIA\n Penyelenggaraan Usaha Perasuransian (Lembaran Negara Republik\nIndonesia Tahun 1992 Nomor 120, Tambahan Lembaran Negara\nRepublik Indonesia Nomor 3506) sebagaimana telah diubah dengan\nPeraturan Pemerintah Nomor 63 .Tahun 1999 (Lembaran Negara\nNegara Republik Indonesia Nomor 3861);\n Keputusan Presiden Nomor 20/P Tahun 2005j\n Keputusan Menteri Keuangan Nomor 337/KMK.011/1981 tentang\nPenunjukan Perusahaan Perseroan (Persero) Asuransi Kerugian Jasa\nRaharja untuk\n menyelenggarakan Dana Pertanggungan Wajib\nKecelakaan Penumpang dan Dana Kecelakaan Lalu Lintas Jalan;\nMEMUTUSKAN:\nMenetapkan : PERATURAN\nMENTERI\nKEUANGAN\nTENTANG\nBESAR\nLALU LINTAS JALAN\nPasal 1\n(1) Sumbangan Wajib Dana Kecelakaan Lalu Lintas Jalan,\nselanjutnya\n disebut SWDKLLJ, adalah sumbangan\nwajib\nsebagaimana dimaksud dalam Undang-Undang Nomor 34 Tahun\n1964 tentang Dana Kecelakaan Lalu Lintas Jalan juncto Peraturan\nPelaksanaan Dana Kecelakaan Lalu Lintas Jalan.",
            "Sepeda motor, sepeda kumbang dan scooter di atas 50 cc sampai\n250 cc dan kendaraan bermotor roda tiga sebesar Rp 32.000,00\n(tiga puluh dua ribu rupiah).\nd.\nPick up/mobil barang sampai dengan 2400 cc, sedan, jeep dan\n mobil penumpang bukan angkutan umum sebesar Rp140.000,00\n(seratus empat puluh ribu rupiah)."
        ],
        "ground_truth": "Rp 160.000,00.",
        "faithfulness": 1.0,
        "answer_relevancy": 0.8079025213890997,
        "context_precision": 0.249999999975,
        "context_recall": 1.0,
        "answer_similarity": 0.8101236506695428,
        "answer_correctness": 0.9525309126673858,
        "harmfulness": 0
    },
    "6": {
        "question": "Apakah kendaraan-kendaraan tersebut dikenakan biaya penggantian pembuatan Kartu Dana/Sertifikat?",
        "answer": "Ya, kendaraan-kendaraan tersebut dikenakan biaya untuk pembuatan Kartu Dana/Sertifikat.\n\nSource: [36/PMK.010/2008](https://www.ojk.go.id/id/regulasi/Documents/Pages/PMK-Nomor-36PMK.010-Tahun-2008-tentang-Besar-Santunan-dan-Sumbangan-Wajib-Dana-Kecelakaan-Lalu-Lintas-Jalan/menas13_1389258036.pdf#page=4)",
        "contexts": [
            "MENTERI KEUANGAN\nREPUBLIK INDONESIA\n-4-\n Mobil penumpang angkutan umum sampai dengan 1600 cc\ng. Bus dan mikro bus bukan angkutan umum sebesar Rp150.000,00\n(seratus lima puluh ribu rupiah).\nh. Bus dan.mikro bus angkutan umum, serta mobil penumpang\nangkutan umum lainnya di atas 1600 cc sebesar Rp87.000,00\n(delapan puluh tujuh ribu rupiah).\nTruk, mobil tangki, mobil gandengan, mobil barang di atas 2400\ncc, truk container dan sejenisnya sebesar Rp 160.000,00 (seratus\n enam puluh ribu rupiah).\nPasal 5\nSetiap jenis kendaraan sebagaimana dimaksud dalam Pasal 4, dikenakan\nbiaya\n penggantian pembuatan\n Kartu Dana/Sertifikat sebesar\nRp 3.000,00 (tiga ribu rupiah).\nPasal 6\nTanda Nomor Kendaraan Bermotor sesuai dengan ketentuan\nperaturan perundang-undangan yang berlaku.\n2) Dalam hal pembayaran SWDKLLJ dilakukan setelah melewati batas\n seharusnya dibayar dengan ketentuan denda yang dikenakan paling\nbesar Rp100.000,00 (seratus ribu rupiah).",
            "PREMI MURNI SERTA UNSUR BIAYA ADMINISTRASI DAN \nBIAYA UMUM LAINNYA PADA LINI USAHA ASURANSI \nKENDARAAN BERMOTOR TAHUN 2010.  \nPasal 1 \nReferensi unsur premi murni pada lini usaha asuransi kendaraan \nbermotor yang dapat digunakan oleh Perusahaan Asuransi Umum \nsebagaimana dimaksud dalam Pasal 3 ayat (1) Peraturan Menteri \nKeuangan Republik Indonesia Nomor 74/PMK.010/2007 tentang \nPenyelenggaraan Pertanggungan Asuransi Pada Lini Usaha Asuransi \nKendaraan \nBermotor \nadalah \nsebagaimana \ntercantum \ndalam \nLampiran 1 Peraturan Ketua Badan Pengawas Pasar Modal dan \nLembaga Keuangan ini. \nPasal 2 \n(1) Perusahaan asuransi umum yang memiliki data profil risiko dan \nkerugian untuk periode 5 (lima) tahun atau lebih wajib \nmenggunakan data sendiri dalam menetapkan tarif premi murni, \ndengan memperhitungkan faktor kredibilitas. \n(2) Penggunaan faktor kredibilitas dalam penetapan tarif premi \nmurni dilakukan dengan tata cara dan formula sebagaimana",
            "MENTERI KEUANGAN\nREPUBLIK INDONESIA\nPasal 7\nDalam hal Pemerintah Daerah melakukan pembebasan terhadap Pajak\nperusahaan yang ditunjuk untuk menyelenggarakan Dana Kecelakaan\nLalu Lintas Jalan dapat menetapkan kebijakan pembebasan pembayaran\nSWDKLLJ, Kartu Dana/Sertifikat, dan besar denda SWDKLLJ yang\ntertunggak untuk tahun yang lewat, dengan mempertimbangkan\nkebijakan Pemerintah Daerah setempat.\nPasal 8\nPada saat Peraturan Menteri Keuangan ini mulai berlaku, Keputusan\nMenteri Keuangan Nomor 416/KMK.06/2001 tentang Penetapan\nSantunan dan Sumbangan Wajib Dana Kecelakaan Lalu Lintas Jalan,\ndicabut dan dinyatakan tidak berlaku.\nPasal 9\nPeraturan Menteri Keuangan ini mulai berlaku setelah 30 (tiga puluh\nhari sejak tanggal ditetapkan.\nPeraturan Menteri Keuangan ini dengan penempatannya dalam Berita\nNegara Republik Indonesia.\nDitetapkan di Jakarta\npada tanggal 26 Februari 2008\nMENTERI KEUANGAN\nttd\nSalinan sesuai dengan aslinya\nSRI MULYANI INDRAWATI\nn Tata Usaha Departemen",
            "DAN BIAYA UMUM LAINNYA PADA LINI USAHA ASURANSI  \nKENDARAAN BERMOTOR TAHUN 2010  \n \nKETUA BADAN PENGAWAS PASAR MODAL  \nDAN LEMBAGA KEUANGAN,  \n \nMenimbang : \na. bahwa berdasarkan Pasal 3 ayat (3) Peraturan Menteri \nKeuangan Nomor 74/PMK.010/2007 tentang Penyelenggaraan \nPertanggungan Asuransi Pada Lini Usaha Asuransi Kendaraan \nBermotor, referensi unsur premi murni serta unsur biaya \nadministrasi dan biaya umum lainnya perlu ditinjau setiap \ntahun dan perubahannya ditetapkan oleh Ketua Badan \nPengawas Pasar Modal dan Lembaga Keuangan; \nb. bahwa berdasarkan pertimbangan sebagaimana dimaksud pada \nhuruf a, perlu untuk menetapkan referensi unsur premi serta \nunsur biaya administrasi dan biaya umum lainnya yang baru \ndengan Peraturan Ketua Badan Pengawas Pasar Modal dan \nLembaga Keuangan;  \nMengingat \n: \n1. Undang-undang \nNomor \n2 \nTahun \n1992 \ntentang \nUsaha \nPerasuransian (Lembaran Negara Republik Indonesia Tahun \n1992 Nomor 13, Tambahan Lembaran Negara Nomor 3467); \n2. Peraturan",
            "Kendaraan Bermotor dihitung dengan menggunakan referensi unsur \npremi murni sesuai Lampiran 1  Peraturan Ketua Badan Pengawas \nPasar Modal dan Lembaga Keuangan ini. \nPasal 5 \nPeraturan Ketua Badan Pengawas Pasar Modal dan Lembaga \nKeuangan Nomor PER-06/BL/2008 tentang Referensi Unsur Premi \nMurni Serta Unsur Biaya Administrasi Dan Biaya Umum Lainnya \nPada Lini Usaha Asuransi Kendaraan Bermotor Tahun 2008 - 2009 \nberlaku sampai dengan tanggal 28 Februari 2010. \nPasal 6 \nPeraturan Ketua Badan Pengawas Pasar Modal dan Lembaga \nKeuangan ini mulai berlaku pada tanggal 1 Maret 2010. \nAgar setiap orang mengetahuinya, memerintahkan pengumuman \nPeraturan Ketua Badan Pengawas Pasar Modal dan Lembaga \nKeuangan ini dengan penempatannya dalam Berita Negara Republik \nIndonesia.  \n \nDitetapkan di \n:  Jakarta \npada tanggal \n:  31 Desember  2009 \n \n \n \nSalinan sesuai dengan aslinya \nKepala Bagian Umum \n \nttd. \n \nPrasetyo Wahyu Adi Suryo  \nNIP 060076008 \nKetua Badan Pengawas Pasar Modal",
            "MENTERI KEUANGAN\nREPUBLIK INDONESIA\nmemperoleh santunan sebesar Rp 25.000.000,00 (dua puluh lima\njuta rupiah).\nb. Korban yang mengalami cacat tetap berhak memperoleh\nsantunan yang besarnya dihitung berdasarkan angka prosentase\n Korban yang memerlukan perawatan dan pengobatan berhak\nrupiah).\nPasal 3\nDalam hal korban meninggal dunia akibat kecelakaan alat angkutan\nlalu lintas jalan tidak mempunyai ahli waris, kepada pihak yang\nmenyelenggarakan\ndiberikan\npenggantian\nbiaya\nPasal 4\n(2) Besar SWDKLLJ sebagaimana dimaksud pada ayat (1) ditentukan\nsebagai berikut:\nSepeda motor di bawah 50 cc, mobil ambulance, mobil jenazah\na.\ndan mobil pemadam kebakaran dibebaskan dari kewajiban\nb. Traktor, buidozer, forklift, mobil derek, excavator, crane dan\nsejenisnya sebesar Rp 20.000,00 (dua puluh ribu rupiah):\n Sepeda motor, sepeda kumbang dan scooter di atas 50 cc sampai\n250 cc dan kendaraan bermotor roda tiga sebesar Rp 32.000,00\n(tiga puluh dua ribu rupiah).\nd."
        ],
        "ground_truth": "Ya, setiap jenis kendaraan sebagaimana dimaksud dalam Pasal 4, dikenakan biaya penggantian pembuatan Kartu Dana/Sertifikat sebesar Rp 3.000,00.",
        "faithfulness": 1.0,
        "answer_relevancy": 0.9859938481421779,
        "context_precision": 0.9999999999833333,
        "context_recall": 1.0,
        "answer_similarity": 0.9232422905105524,
        "answer_correctness": 0.7308105726276382,
        "harmfulness": 0
    },
    "7": {
        "question": "Apa judul peraturan yang membahas tentang SWDKLLJ tersebut?",
        "answer": "Peraturan Menteri Keuangan Nomor 36/PMK.010/2008 tentang Besar Santunan dan Sumbangan Wajib Dana Kecelakaan Lalu Lintas Jalan\n\nSource: [36/PMK.010/2008](https://www.ojk.go.id/id/regulasi/Documents/Pages/PMK-Nomor-36PMK.010-Tahun-2008-tentang-Besar-Santunan-dan-Sumbangan-Wajib-Dana-Kecelakaan-Lalu-Lintas-Jalan/menas13_1389258036.pdf)",
        "contexts": [
            "wajib\nsebagaimana dimaksud dalam Undang-Undang Nomor 34 Tahun\n1964 tentang Dana Kecelakaan Lalu Lintas Jalan juncto Peraturan\nPelaksanaan Dana Kecelakaan Lalu Lintas Jalan.\n2) SWDKLLJ merupakan premi asuransi yang dibayarkan oleh para\npengusaha/pemilik alat angkutan lalu lintas jalan kepada\nperusahaan yang menyelenggarakan Dana Kecelakaan Lalu Lintas\nJalan.\nPasal 2\n(1 Korban kecelakaan alat angkutan lalu lintas jalan atau ahli warisnya\nberhak atas santunan.\nBesar santunan sebagaimana dimaksud pada ayat (1) ditentukan\nsebagai berikut:",
            "REPUBLIK INDONESIA\n Penyelenggaraan Usaha Perasuransian (Lembaran Negara Republik\nIndonesia Tahun 1992 Nomor 120, Tambahan Lembaran Negara\nRepublik Indonesia Nomor 3506) sebagaimana telah diubah dengan\nPeraturan Pemerintah Nomor 63 .Tahun 1999 (Lembaran Negara\nNegara Republik Indonesia Nomor 3861);\n Keputusan Presiden Nomor 20/P Tahun 2005j\n Keputusan Menteri Keuangan Nomor 337/KMK.011/1981 tentang\nPenunjukan Perusahaan Perseroan (Persero) Asuransi Kerugian Jasa\nRaharja untuk\n menyelenggarakan Dana Pertanggungan Wajib\nKecelakaan Penumpang dan Dana Kecelakaan Lalu Lintas Jalan;\nMEMUTUSKAN:\nMenetapkan : PERATURAN\nMENTERI\nKEUANGAN\nTENTANG\nBESAR\nLALU LINTAS JALAN\nPasal 1\n(1) Sumbangan Wajib Dana Kecelakaan Lalu Lintas Jalan,\nselanjutnya\n disebut SWDKLLJ, adalah sumbangan\nwajib\nsebagaimana dimaksud dalam Undang-Undang Nomor 34 Tahun\n1964 tentang Dana Kecelakaan Lalu Lintas Jalan juncto Peraturan\nPelaksanaan Dana Kecelakaan Lalu Lintas Jalan.",
            "MENTERI KEUANGAN\nREPUBLIK INDONESIA\nPasal 7\nDalam hal Pemerintah Daerah melakukan pembebasan terhadap Pajak\nperusahaan yang ditunjuk untuk menyelenggarakan Dana Kecelakaan\nLalu Lintas Jalan dapat menetapkan kebijakan pembebasan pembayaran\nSWDKLLJ, Kartu Dana/Sertifikat, dan besar denda SWDKLLJ yang\ntertunggak untuk tahun yang lewat, dengan mempertimbangkan\nkebijakan Pemerintah Daerah setempat.\nPasal 8\nPada saat Peraturan Menteri Keuangan ini mulai berlaku, Keputusan\nMenteri Keuangan Nomor 416/KMK.06/2001 tentang Penetapan\nSantunan dan Sumbangan Wajib Dana Kecelakaan Lalu Lintas Jalan,\ndicabut dan dinyatakan tidak berlaku.\nPasal 9\nPeraturan Menteri Keuangan ini mulai berlaku setelah 30 (tiga puluh\nhari sejak tanggal ditetapkan.\nPeraturan Menteri Keuangan ini dengan penempatannya dalam Berita\nNegara Republik Indonesia.\nDitetapkan di Jakarta\npada tanggal 26 Februari 2008\nMENTERI KEUANGAN\nttd\nSalinan sesuai dengan aslinya\nSRI MULYANI INDRAWATI\nn Tata Usaha Departemen",
            "Peraturan Pemerintah Nomor 81 Tahun 2008 (Lembaran \nNegara Republik Indonesia Tahun 2008 Nomor 212, \nTambahan Lembaran Negara Republik Indonesia Nomor \n4954); \n3. Peraturan Presiden Republik Indonesia Nomor 24 Tahun \n2010 \ntentang \nKedudukan, \nTugas, \nDan \nFungsi \nKementerian Negara Serta Susunan Organisasi, Tugas, \nDan Fungsi Eselon I Kementerian Negara sebagaimana \ntelah beberapa kali diubah terakhir dengan Peraturan \nPresiden Republik Indonesia Nomor 92 Tahun 2011; \n4. Peraturan Menteri Keuangan Nomor 184/PMK.01/2010 \ntentang \nOrganisasi \nDan \nTata \nKerja \nKementerian \nKeuangan; \n5. Peraturan Menteri Keuangan Republik Indonesia Nomor \n53/PMK.010/2012 \nTentang \nKesehatan \nKeuangan \nPerusahaan Asuransi Dan Perusahaan Reasuransi. \nMEMUTUSKAN: \nMenetapkan   : PERATURAN KETUA BADAN PENGAWAS PASAR MODAL \nDAN LEMBAGA KEUANGAN TENTANG LAPORAN AKTUARIS \nPERUSAHAAN ASURANSI DAN PERUSAHAAN REASURANSI. \nSALINAN",
            "menetapkan \nPeraturan \nPemerintah \nPengganti \nUndang-Undang tentang Perubahan Kedua Atas \nUndang-Undang Nomor 23 Tahun 1999 tentang \nBank Indonesia; \n \nMengingat \n: 4. \nPasal 22 ayat (1) Undang-Undang Dasar Negara \nRepublik Indonesia Tahun 1945;  \n \n \n2. Undang-Undang \u2026 \n \nLAMPIRAN \nUNDANG-UNDANG REPUBLIK INDONESIA \nNOMOR    : 6 TAHUN 2009 \nTANGGAL : 13 JANUARI 2009",
            "metadata={'title': 'POJK tentang Investasi Surat Berharga Negara Bagi Lembaga Jasa Keuangan Non-Bank', 'sector': 'IKNB', 'subsector': 'Asuransi,  Dana Pensiun,  Lembaga Pembiayaan,  Lembaga Jasa Keuangan Khusus,  Lembaga Keuangan Mikro', 'regulation_type': 'Peraturan OJK', 'regulation_number': '1 /POJK.05/2016', 'effective_date': '12 Januari 2016', 'file_url': 'https://www.ojk.go.id/id/regulasi/Documents/Pages/POJK-01.-SBN/POJK%201-2016.pdf', 'page_number': 7}\n- 7 - \n \nAgar \nsetiap \norang \nmengetahuinya, \nmemerintahkan \npengundangan Peraturan OJK ini dengan penempatannya \ndalam Lembaran Negara Republik Indonesia. \n \n \nDitetapkan di Jakarta \npada tanggal 11 Januari 2016 \n \nKETUA DEWAN KOMISIONER  \nOTORITAS JASA KEUANGAN,  \n \n     ttd \n \n     MULIAMAN D. HADAD \n \nDiundangkan di Jakarta  \npada tanggal 12 Januari 2016 \n \nMENTERI HUKUM DAN HAK ASASI MANUSIA  \nREPUBLIK INDONESIA,  \n \nttd \n \nYASONNA H. LAOLY \n \n \nLEMBARAN NEGARA REPUBLIK INDONESIA TAHUN 2016 NOMOR 7"
        ],
        "ground_truth": "Besar Santunan dan Sumbangan Wajib Dana Kecelakaan Lalu Lintas Jalan.",
        "faithfulness": 0.0,
        "answer_relevancy": 0.8416488986150134,
        "context_precision": 0.9999999999666667,
        "context_recall": 1.0,
        "answer_similarity": 0.9201003726486059,
        "answer_correctness": 0.6050250931621515,
        "harmfulness": 0
    },
    "8": {
        "question": "Berapa nomor regulasi peraturan tersebut?",
        "answer": "Peraturan BAPEPAM tentang Laporan Aktuaris Perusahaan Asuransi dan Perusahaan Reasuransi:\n\nNomor regulasi: PER- 10/BL/2012\nSumber: [PER- 10/BL/2012](https://www.ojk.go.id/id/regulasi/Documents/Pages/Peraturan-BAPEPAM-tentang-Laporan-Aktuaris-Perusahaan-Asuransi-dan-Perusahaan-Reasuransi/BAPEPAM-LK%20PER-10BL2012.pdf)",
        "contexts": [
            "Peraturan Pemerintah Nomor 81 Tahun 2008 (Lembaran \nNegara Republik Indonesia Tahun 2008 Nomor 212, \nTambahan Lembaran Negara Republik Indonesia Nomor \n4954); \n3. Peraturan Presiden Republik Indonesia Nomor 24 Tahun \n2010 \ntentang \nKedudukan, \nTugas, \nDan \nFungsi \nKementerian Negara Serta Susunan Organisasi, Tugas, \nDan Fungsi Eselon I Kementerian Negara sebagaimana \ntelah beberapa kali diubah terakhir dengan Peraturan \nPresiden Republik Indonesia Nomor 92 Tahun 2011; \n4. Peraturan Menteri Keuangan Nomor 184/PMK.01/2010 \ntentang \nOrganisasi \nDan \nTata \nKerja \nKementerian \nKeuangan; \n5. Peraturan Menteri Keuangan Republik Indonesia Nomor \n53/PMK.010/2012 \nTentang \nKesehatan \nKeuangan \nPerusahaan Asuransi Dan Perusahaan Reasuransi. \nMEMUTUSKAN: \nMenetapkan   : PERATURAN KETUA BADAN PENGAWAS PASAR MODAL \nDAN LEMBAGA KEUANGAN TENTANG LAPORAN AKTUARIS \nPERUSAHAAN ASURANSI DAN PERUSAHAAN REASURANSI. \nSALINAN",
            "metadata={'title': 'Peraturan Pemerintah Republik Indonesia Nomor 63 Tahun 1999 tentang Perubahan atas Peraturan Pemerintah Nomor 73 Tahun 1992 tentang Penyelenggaraan Usaha Perasuransian', 'sector': 'IKNB', 'subsector': 'Asuransi', 'regulation_type': 'Peraturan Pemerintah', 'regulation_number': '63 TAHUN 1999', 'effective_date': '2 Juli 1999', 'file_url': 'https://www.ojk.go.id/id/regulasi/Documents/Pages/PP-RI-Nomor-63-Tahun-1999-tentang-Perubahan-atas-Peraturan-Pemerintah-Nomor-73-Tahun-1992/ppas3_1389239909.pdf', 'page_number': 13}\nCukup jelas \nAngka 13 \nPasal 42 \nAyat (1) \nCukup jelas \nPasal II \nCukup jelas \nPasal III \nCukup jelas \n  \nTAMBAHAN LEMBARAN NEGARA REPUBLIK INDONESIA NOMOR 3861",
            "metadata={'title': 'Peraturan Pemerintah nomor 73 Tahun 1992 tentang Penyelenggaraan Usaha Perasuransian', 'sector': 'IKNB', 'subsector': 'Asuransi', 'regulation_type': 'Peraturan Pemerintah', 'regulation_number': '73 Tahun 1992', 'effective_date': '30 Oktober 1992', 'file_url': 'https://www.ojk.go.id/id/regulasi/Documents/Pages/PP-nomor-73-Tahun-1992-tentang-Penyelenggaraan-Usaha-Perasuransian/PP%20NO.73%20TAHUN%201992.pdf', 'page_number': 25}\nAyat \n(3) \nCukup jelas \n \nPasal 45 \nCukup jelas \n \nPasal 46 \nCukup jelas \n \nPasal 47 \nCukup jelas",
            "metadata={'title': 'Peraturan Bank Indonesia Nomor 6/22/PBI/2004', 'sector': 'Perbankan', 'subsector': 'Bank Umum,  BPR', 'regulation_type': 'PPBI', 'regulation_number': '6/22/PBI/2004', 'effective_date': '9 Agustus 2004', 'file_url': 'https://www.ojk.go.id/id/regulasi/Documents/Pages/Peraturan-Bank-Indonesia-Nomor-622PBI2004/324.pdf', 'page_number': 62}\n \n- 3-\nAngka 4  \nCukup jelas. \nAngka 5  \nCukup jelas. \nAngka 6 \nCukup jelas. \nAngka 7 \nCukup jelas. \nAngka 8 \nCukup jelas. \nAngka 9 \nKetentuan ini dimaksudkan agar anggota Direksi \ntidak melakukan kegiatan yang dapat menganggu \npelaksanaan tugas dan tanggung jawab sebagai \nDireksi. \nAngka 10 \nSertifikat kelulusan merupakan standar kompetensi \ndan keahlian sebagai anggota Direksi. \nAngka 11 \nCukup jelas. \n \n \nAngka 12 \u2026",
            "metadata={'title': 'Peraturan Bank Indonesia Nomor 6/22/PBI/2004', 'sector': 'Perbankan', 'subsector': 'Bank Umum,  BPR', 'regulation_type': 'PPBI', 'regulation_number': '6/22/PBI/2004', 'effective_date': '9 Agustus 2004', 'file_url': 'https://www.ojk.go.id/id/regulasi/Documents/Pages/Peraturan-Bank-Indonesia-Nomor-622PBI2004/324.pdf', 'page_number': 63}\n \n- 4-\nAngka 12 \nCukup jelas. \nAngka 13  \nCukup jelas. \nAngka 14 \nKetentuan ini dimaksudkan agar anggota dewan \nKomisaris secara sungguh-sungguh melaksanakan \nfungsinya dalam mengawasi BPR. \nAngka 15 \nCukup jelas. \nHuruf d \nAntara lain meliputi bagan organisasi, garis tanggung jawab \nhorizontal dan vertikal, serta jabatan paling rendah sampai \ndengan tingkatan Pejabat Eksekutif. \nHuruf e \nCukup jelas. \nHuruf f \nCukup jelas. \nHuruf g \nContoh penulisan keterangan atas setoran modal pada bilyet \ndeposito adalah \u201cDewan Gubernur Bank Indonesia  qq. Sdr. \n\u2018A\u2019 untuk pendirian PT BPR \u2018XYZ\u2019 \u201d. \nHuruf h \u2026",
            "waktu 30 (tiga puluh) hari sejak berlakunya peraturan dimaksud dengan menggunakan\nFormulir Nomor III.B.2-6 lampiran 6 peraturan ini.\nDitetapkan di      :   Jakarta\nPada tanggal      :   17 Januari 1996\nBADAN PENGAWAS PASAR MODAL\nKetua,\nI PUTU GEDE ARY SUTA\nNIP. 060065493\nLAMPIRAN\nK e p u t u s a n  K e t u a  B a d a n\nP e n g a w a s  P a s a r  M o d a l\nNomor \n:\nKep- 08/PM/1996\nTanggal\n:\n17 Januari 1996"
        ],
        "ground_truth": "Peraturan Menteri Keuangan Nomor 36/PMK.010/2008.",
        "faithfulness": 0.0,
        "answer_relevancy": 0.8721015213192599,
        "context_precision": 0.0,
        "context_recall": 0.0,
        "answer_similarity": 0.8307458938467956,
        "answer_correctness": 0.2076864734616989,
        "harmfulness": 0
    },
    "9": {
        "question": "Kapan dan dimana peraturan tersebut ditetapkan?",
        "answer": "Peraturan Menteri Keuangan Nomor 36/PMK.010/2008 tentang Besar Santunan dan Sumbangan Wajib Dana Kecelakaan Lalu Lintas Jalan ditetapkan pada tanggal 26 Februari 2008 di Jakarta.\n\nSource: [36/PMK.010/2008](https://www.ojk.go.id/id/regulasi/Documents/Pages/PMK-Nomor-36PMK.010-Tahun-2008-tentang-Besar-Santunan-dan-Sumbangan-Wajib-Dana-Kecelakaan-Lalu-Lintas-Jalan/menas13_1389258036.pdf)",
        "contexts": [
            "MENTERI KEUANGAN\nREPUBLIK INDONESIA\nSALINAN\nPERATURAN MENTERI KEUANGAN\n36 /PMK.010/2008\nNOMOR\nTENTANG\nBESAR SANTUNAN DAN SUMBANGAN WAJIB\nDANA KECELAKAAN LALU LINTAS IALAN\nMENTERI KEUANGAN\nMenimbang : a. bahwa untuk memenuhi kecukupan sosial (social adequacy) dalam\npemberian perlindungan dasar kepada masyarakat yang menjadi\n kecelakaan alat angkutan lalu-lintas\nkorban\nmeningkatkan\n besar santunan dengan mempertimbangkan\npeningkatan kebutuhan hidup dan tingkat inflasi;\nb. bahwa sehubungan dengan huruf a tersebut, perlu melakukan\npenyesuaian terhadap ketentuan yang mengatur mengenai besar\n bahwa berdasarkan pertimbangan sebagaimana di maksud dalam\n huruf a dan huruf b, perlu menetapkan Peraturan Menteri Keuangan\ntentang Besar Santunan dan Sumbangan Wajib Dana Kecelakaan\nLalu Lintas Jalan;\nMengingat\nLalu Lintas Jalan (Lembaran Negara Republik Indonesia Tahun 1964\nNomor 138, Tambahan Lembaran Negara Republik Indonesia\nNomor 2721);",
            "REPUBLIK INDONESIA\n Penyelenggaraan Usaha Perasuransian (Lembaran Negara Republik\nIndonesia Tahun 1992 Nomor 120, Tambahan Lembaran Negara\nRepublik Indonesia Nomor 3506) sebagaimana telah diubah dengan\nPeraturan Pemerintah Nomor 63 .Tahun 1999 (Lembaran Negara\nNegara Republik Indonesia Nomor 3861);\n Keputusan Presiden Nomor 20/P Tahun 2005j\n Keputusan Menteri Keuangan Nomor 337/KMK.011/1981 tentang\nPenunjukan Perusahaan Perseroan (Persero) Asuransi Kerugian Jasa\nRaharja untuk\n menyelenggarakan Dana Pertanggungan Wajib\nKecelakaan Penumpang dan Dana Kecelakaan Lalu Lintas Jalan;\nMEMUTUSKAN:\nMenetapkan : PERATURAN\nMENTERI\nKEUANGAN\nTENTANG\nBESAR\nLALU LINTAS JALAN\nPasal 1\n(1) Sumbangan Wajib Dana Kecelakaan Lalu Lintas Jalan,\nselanjutnya\n disebut SWDKLLJ, adalah sumbangan\nwajib\nsebagaimana dimaksud dalam Undang-Undang Nomor 34 Tahun\n1964 tentang Dana Kecelakaan Lalu Lintas Jalan juncto Peraturan\nPelaksanaan Dana Kecelakaan Lalu Lintas Jalan.",
            "MENTERI KEUANGAN\nREPUBLIK INDONESIA\nPasal 7\nDalam hal Pemerintah Daerah melakukan pembebasan terhadap Pajak\nperusahaan yang ditunjuk untuk menyelenggarakan Dana Kecelakaan\nLalu Lintas Jalan dapat menetapkan kebijakan pembebasan pembayaran\nSWDKLLJ, Kartu Dana/Sertifikat, dan besar denda SWDKLLJ yang\ntertunggak untuk tahun yang lewat, dengan mempertimbangkan\nkebijakan Pemerintah Daerah setempat.\nPasal 8\nPada saat Peraturan Menteri Keuangan ini mulai berlaku, Keputusan\nMenteri Keuangan Nomor 416/KMK.06/2001 tentang Penetapan\nSantunan dan Sumbangan Wajib Dana Kecelakaan Lalu Lintas Jalan,\ndicabut dan dinyatakan tidak berlaku.\nPasal 9\nPeraturan Menteri Keuangan ini mulai berlaku setelah 30 (tiga puluh\nhari sejak tanggal ditetapkan.\nPeraturan Menteri Keuangan ini dengan penempatannya dalam Berita\nNegara Republik Indonesia.\nDitetapkan di Jakarta\npada tanggal 26 Februari 2008\nMENTERI KEUANGAN\nttd\nSalinan sesuai dengan aslinya\nSRI MULYANI INDRAWATI\nn Tata Usaha Departemen",
            "wajib\nsebagaimana dimaksud dalam Undang-Undang Nomor 34 Tahun\n1964 tentang Dana Kecelakaan Lalu Lintas Jalan juncto Peraturan\nPelaksanaan Dana Kecelakaan Lalu Lintas Jalan.\n2) SWDKLLJ merupakan premi asuransi yang dibayarkan oleh para\npengusaha/pemilik alat angkutan lalu lintas jalan kepada\nperusahaan yang menyelenggarakan Dana Kecelakaan Lalu Lintas\nJalan.\nPasal 2\n(1 Korban kecelakaan alat angkutan lalu lintas jalan atau ahli warisnya\nberhak atas santunan.\nBesar santunan sebagaimana dimaksud pada ayat (1) ditentukan\nsebagai berikut:",
            "waktu 30 (tiga puluh) hari sejak berlakunya peraturan dimaksud dengan menggunakan\nFormulir Nomor III.B.2-6 lampiran 6 peraturan ini.\nDitetapkan di      :   Jakarta\nPada tanggal      :   17 Januari 1996\nBADAN PENGAWAS PASAR MODAL\nKetua,\nI PUTU GEDE ARY SUTA\nNIP. 060065493\nLAMPIRAN\nK e p u t u s a n  K e t u a  B a d a n\nP e n g a w a s  P a s a r  M o d a l\nNomor \n:\nKep- 08/PM/1996\nTanggal\n:\n17 Januari 1996",
            "AEPUBLIK INDONESIA\nPasal 8\nPersyaratan dokumen fotokopi tanda bukti kelulusan penilaian\nkemampuan dan kepatutan sebagaimana dimaksud dalan Pasal 3 ayat\npendiriannya disahkan sebelum tanggal 12 Februari 2011.\nBAB V\nKETENTUAN PENUTUP\nPasal 9\nPada saat Peraturan Menteri Keuangan ini mulai berlaku, Keputusan\nMenteri Keuangan Nomor 228/KMK.017/1993 tentang Tata Cara\nPermohonan Pengesahan Pendirian Dana Pensiun Lembaga Keuangan\ndan Pengesahan Atas Perubahan Peraturan Dana Pensiun dari Dana\nPensiun Lembaga Keuangan sebagaimana diubah dengan Keputusan\n Menteri Keuangan Nomor 802/KMK.01/1993, dicabut dan dinyatakan\nPasal 10\ndiundangkan.\nAgar setiap orang mengetahuinya, memerintahkan pengundangan\nPeraturan Menteri Keuangan ini dengan penempatannya dalam Berita\nNegara Republik Indonesia.\nDitetapkan di Jakarta\npada tanggal 7 Februari 2011\nMENTERI KEUANGAN,\nttd.\nDiundangkan di Jakarta\nPadatanggal 7 Februari 20ll\nAGUS D.W. MARTOWARDOJO\nMENTERI HUKUM DAN HAK ASASI MANUSIA\nPATRIALIS AKBAR"
        ],
        "ground_truth": "26 Februari 2008 di Jakarta.",
        "faithfulness": 1.0,
        "answer_relevancy": 0.8527126314605952,
        "context_precision": 0.999999999975,
        "context_recall": 0.75,
        "answer_similarity": 0.8075101190621186,
        "answer_correctness": 0.5768775297655296,
        "harmfulness": 0
    }
}