question,answer,contexts,ground_truth,faithfulness,answer_relevancy,context_precision,context_recall,answer_similarity,answer_correctness,harmfulness
Apa itu SWDKLLJ?,"SWDKLLJ adalah singkatan dari Sumbangan Wajib Dana Kecelakaan Lalu Lintas Jalan. 

Source: [36/PMK.010/2008](https://www.ojk.go.id/id/regulasi/Documents/Pages/PMK-Nomor-36PMK.010-Tahun-2008-tentang-Besar-Santunan-dan-Sumbangan-Wajib-Dana-Kecelakaan-Lalu-Lintas-Jalan/menas13_1389258036.pdf#page=2)","['wajib\nsebagaimana dimaksud dalam Undang-Undang Nomor 34 Tahun\n1964 tentang Dana Kecelakaan Lalu Lintas Jalan juncto Peraturan\nPelaksanaan Dana Kecelakaan Lalu Lintas Jalan.\n2) SWDKLLJ merupakan premi asuransi yang dibayarkan oleh para\npengusaha/pemilik alat angkutan lalu lintas jalan kepada\nperusahaan yang menyelenggarakan Dana Kecelakaan Lalu Lintas\nJalan.\nPasal 2\n(1 Korban kecelakaan alat angkutan lalu lintas jalan atau ahli warisnya\nberhak atas santunan.\nBesar santunan sebagaimana dimaksud pada ayat (1) ditentukan\nsebagai berikut:'
 'REPUBLIK INDONESIA\n Penyelenggaraan Usaha Perasuransian (Lembaran Negara Republik\nIndonesia Tahun 1992 Nomor 120, Tambahan Lembaran Negara\nRepublik Indonesia Nomor 3506) sebagaimana telah diubah dengan\nPeraturan Pemerintah Nomor 63 .Tahun 1999 (Lembaran Negara\nNegara Republik Indonesia Nomor 3861);\n Keputusan Presiden Nomor 20/P Tahun 2005j\n Keputusan Menteri Keuangan Nomor 337/KMK.011/1981 tentang\nPenunjukan Perusahaan Perseroan (Persero) Asuransi Kerugian Jasa\nRaharja untuk\n menyelenggarakan Dana Pertanggungan Wajib\nKecelakaan Penumpang dan Dana Kecelakaan Lalu Lintas Jalan;\nMEMUTUSKAN:\nMenetapkan : PERATURAN\nMENTERI\nKEUANGAN\nTENTANG\nBESAR\nLALU LINTAS JALAN\nPasal 1\n(1) Sumbangan Wajib Dana Kecelakaan Lalu Lintas Jalan,\nselanjutnya\n disebut SWDKLLJ, adalah sumbangan\nwajib\nsebagaimana dimaksud dalam Undang-Undang Nomor 34 Tahun\n1964 tentang Dana Kecelakaan Lalu Lintas Jalan juncto Peraturan\nPelaksanaan Dana Kecelakaan Lalu Lintas Jalan.'
 'MENTERI KEUANGAN\nREPUBLIK INDONESIA\nmemperoleh santunan sebesar Rp 25.000.000,00 (dua puluh lima\njuta rupiah).\nb. Korban yang mengalami cacat tetap berhak memperoleh\nsantunan yang besarnya dihitung berdasarkan angka prosentase\n Korban yang memerlukan perawatan dan pengobatan berhak\nrupiah).\nPasal 3\nDalam hal korban meninggal dunia akibat kecelakaan alat angkutan\nlalu lintas jalan tidak mempunyai ahli waris, kepada pihak yang\nmenyelenggarakan\ndiberikan\npenggantian\nbiaya\nPasal 4\n(2) Besar SWDKLLJ sebagaimana dimaksud pada ayat (1) ditentukan\nsebagai berikut:\nSepeda motor di bawah 50 cc, mobil ambulance, mobil jenazah\na.\ndan mobil pemadam kebakaran dibebaskan dari kewajiban\nb. Traktor, buidozer, forklift, mobil derek, excavator, crane dan\nsejenisnya sebesar Rp 20.000,00 (dua puluh ribu rupiah):\n Sepeda motor, sepeda kumbang dan scooter di atas 50 cc sampai\n250 cc dan kendaraan bermotor roda tiga sebesar Rp 32.000,00\n(tiga puluh dua ribu rupiah).\nd.'
 '2) Dalam hal pembayaran SWDKLLJ dilakukan setelah melewati batas\n seharusnya dibayar dengan ketentuan denda yang dikenakan paling\nbesar Rp100.000,00 (seratus ribu rupiah).\n(3) Dalam hal ketentuan mengenai batas waktu sebagaimana dimaksud\ngeografis daerah setempat, Direksi perusahaan yang ditunjuk untuk\nmenyelenggarakan Dana Kecelakaan Lalu Lintas Jalan diberi\nbesarnya denda SWDKLLJ, dengan ketentuan batas waktu dimaksud\npaling lama 15 (lima belas) hari kerja.'
 'e. surat pernyataan dari pemegang saham yang menyatakan bahwa \nseluruh kewajiban Lembaga Penjamin telah diselesaikan dan apabila \nterdapat tuntutan di kemudian hari menjadi tanggung jawab pemegang \nsaham. \n \nDapat kami sampaikan bahwa untuk keperluan pelaporan ini, dapat \nmenghubungi Sdr./Sdri. ..., melalui alamat email ... atau nomor          \ntelepon ...'
 'Pengelolaan Investasi Terpadu (SEOJK S-INVEST) \n \nPokok-pokok SEOJK S-INVEST adalah sebagai berikut: \n1. \nPengguna S-INVEST yang bertindak sebagai Bank Kustodian Reksa Dana \nmenyampaikan: \na. surat atau bukti konfirmasi atas pelaksanaan perintah penjualan, \npembelian kembali/pelunasan, dan/atau pengalihan saham atau unit \npenyertaan Reksa Dana; dan \nb. laporan berkala terkait mutasi kepemilikan saham atau unit penyertaan \nReksa Dana serta posisi kepemilikan saham atau unit penyertaan Reksa \nDana kepada setiap pemegang saham atau pemegang unit penyertaan \nReksa Dana melalui S-INVEST. \n2. \nPenyedia S-INVEST menyediakan format isian data dan informasi yang \nberkaitan dengan surat atau bukti konfirmasi transaksi saham atau Unit \nPenyertaan Reksa Dana dan laporan berkala Reksa Dana. \n3. \nPengguna S-INVEST yang bertindak sebagai Manajer Investasi dan/atau \nPengguna S-INVEST yang bertindak sebagai Agen Penjual Efek Reksa Dana \nmemastikan:']",Sumbangan Wajib Dana Kecelakaan Lalu Lintas adalah sumbangan wajib sebagaimana dimaksud dalam Undang-Undang Nomor 34 Tahun 1964 tentang Dana Kecelakaan Lalu Lintas Jalan juncto Peraturan Pemerintah Nomor 18 Tahun 1965 tentang Ketentuan-Ketentuan Pelaksanaan Dana Kecelakaan Lalu Lintas Jalan.,1.0,0.9604164661627679,0.9166666666361111,1.0,0.9143513978265925,0.6035766737834365,0
Dipungut dari mana?,"Dana SWDKLLJ dipungut dari para pengusaha/pemilik alat angkutan lalu lintas jalan.

Source: [36/PMK.010/2008](https://www.ojk.go.id/id/regulasi/Documents/Pages/PMK-Nomor-36PMK.010-Tahun-2008-tentang-Besar-Santunan-dan-Sumbangan-Wajib-Dana-Kecelakaan-Lalu-Lintas-Jalan/menas13_1389258036.pdf#page=2)","['wajib\nsebagaimana dimaksud dalam Undang-Undang Nomor 34 Tahun\n1964 tentang Dana Kecelakaan Lalu Lintas Jalan juncto Peraturan\nPelaksanaan Dana Kecelakaan Lalu Lintas Jalan.\n2) SWDKLLJ merupakan premi asuransi yang dibayarkan oleh para\npengusaha/pemilik alat angkutan lalu lintas jalan kepada\nperusahaan yang menyelenggarakan Dana Kecelakaan Lalu Lintas\nJalan.\nPasal 2\n(1 Korban kecelakaan alat angkutan lalu lintas jalan atau ahli warisnya\nberhak atas santunan.\nBesar santunan sebagaimana dimaksud pada ayat (1) ditentukan\nsebagai berikut:'
 'REPUBLIK INDONESIA\n Penyelenggaraan Usaha Perasuransian (Lembaran Negara Republik\nIndonesia Tahun 1992 Nomor 120, Tambahan Lembaran Negara\nRepublik Indonesia Nomor 3506) sebagaimana telah diubah dengan\nPeraturan Pemerintah Nomor 63 .Tahun 1999 (Lembaran Negara\nNegara Republik Indonesia Nomor 3861);\n Keputusan Presiden Nomor 20/P Tahun 2005j\n Keputusan Menteri Keuangan Nomor 337/KMK.011/1981 tentang\nPenunjukan Perusahaan Perseroan (Persero) Asuransi Kerugian Jasa\nRaharja untuk\n menyelenggarakan Dana Pertanggungan Wajib\nKecelakaan Penumpang dan Dana Kecelakaan Lalu Lintas Jalan;\nMEMUTUSKAN:\nMenetapkan : PERATURAN\nMENTERI\nKEUANGAN\nTENTANG\nBESAR\nLALU LINTAS JALAN\nPasal 1\n(1) Sumbangan Wajib Dana Kecelakaan Lalu Lintas Jalan,\nselanjutnya\n disebut SWDKLLJ, adalah sumbangan\nwajib\nsebagaimana dimaksud dalam Undang-Undang Nomor 34 Tahun\n1964 tentang Dana Kecelakaan Lalu Lintas Jalan juncto Peraturan\nPelaksanaan Dana Kecelakaan Lalu Lintas Jalan.'
 'MENTERI KEUANGAN\nREPUBLIK INDONESIA\nmemperoleh santunan sebesar Rp 25.000.000,00 (dua puluh lima\njuta rupiah).\nb. Korban yang mengalami cacat tetap berhak memperoleh\nsantunan yang besarnya dihitung berdasarkan angka prosentase\n Korban yang memerlukan perawatan dan pengobatan berhak\nrupiah).\nPasal 3\nDalam hal korban meninggal dunia akibat kecelakaan alat angkutan\nlalu lintas jalan tidak mempunyai ahli waris, kepada pihak yang\nmenyelenggarakan\ndiberikan\npenggantian\nbiaya\nPasal 4\n(2) Besar SWDKLLJ sebagaimana dimaksud pada ayat (1) ditentukan\nsebagai berikut:\nSepeda motor di bawah 50 cc, mobil ambulance, mobil jenazah\na.\ndan mobil pemadam kebakaran dibebaskan dari kewajiban\nb. Traktor, buidozer, forklift, mobil derek, excavator, crane dan\nsejenisnya sebesar Rp 20.000,00 (dua puluh ribu rupiah):\n Sepeda motor, sepeda kumbang dan scooter di atas 50 cc sampai\n250 cc dan kendaraan bermotor roda tiga sebesar Rp 32.000,00\n(tiga puluh dua ribu rupiah).\nd.'
 '2) Dalam hal pembayaran SWDKLLJ dilakukan setelah melewati batas\n seharusnya dibayar dengan ketentuan denda yang dikenakan paling\nbesar Rp100.000,00 (seratus ribu rupiah).\n(3) Dalam hal ketentuan mengenai batas waktu sebagaimana dimaksud\ngeografis daerah setempat, Direksi perusahaan yang ditunjuk untuk\nmenyelenggarakan Dana Kecelakaan Lalu Lintas Jalan diberi\nbesarnya denda SWDKLLJ, dengan ketentuan batas waktu dimaksud\npaling lama 15 (lima belas) hari kerja.'
 'MENTERI KEUANGAN\nREPUBLIK INDONESIA\nPasal 7\nDalam hal Pemerintah Daerah melakukan pembebasan terhadap Pajak\nperusahaan yang ditunjuk untuk menyelenggarakan Dana Kecelakaan\nLalu Lintas Jalan dapat menetapkan kebijakan pembebasan pembayaran\nSWDKLLJ, Kartu Dana/Sertifikat, dan besar denda SWDKLLJ yang\ntertunggak untuk tahun yang lewat, dengan mempertimbangkan\nkebijakan Pemerintah Daerah setempat.\nPasal 8\nPada saat Peraturan Menteri Keuangan ini mulai berlaku, Keputusan\nMenteri Keuangan Nomor 416/KMK.06/2001 tentang Penetapan\nSantunan dan Sumbangan Wajib Dana Kecelakaan Lalu Lintas Jalan,\ndicabut dan dinyatakan tidak berlaku.\nPasal 9\nPeraturan Menteri Keuangan ini mulai berlaku setelah 30 (tiga puluh\nhari sejak tanggal ditetapkan.\nPeraturan Menteri Keuangan ini dengan penempatannya dalam Berita\nNegara Republik Indonesia.\nDitetapkan di Jakarta\npada tanggal 26 Februari 2008\nMENTERI KEUANGAN\nttd\nSalinan sesuai dengan aslinya\nSRI MULYANI INDRAWATI\nn Tata Usaha Departemen'
 'dinyatakan:  \na. sebagai utang pemberi kerja yang dapat segera ditagih dan dikenakan \nimbal hasil tertentu yang dihitung sejak hari pertama dari bulan \nsebagaimana dimaksud pada ayat (2); dan \nb. sebagai piutang DPPK yang memiliki hak utama, apabila Pemberi Kerja \ndilikuidasi atau dipailitkan. \nBagi Dana Pensiun yang menyelenggarakan program pensiun berdasarkan \nprinsip syariah, iuran peserta dan iuran pemberi kerja yang belum disetor \nsetelah melewati 1 (satu) bulan sejak jatuh tempo, dinyatakan sebagai utang \npemberi kerja dan dikenai sanksi (ta’zir) berupa denda yang dihitung sejak \nhari pertama dari bulan jatuh tempo penyetoran iuran. \n \n30. \nDana yang berasal dari sanksi (ta’zir) berupa denda, tidak termasuk \ndalam aset Dana Pensiun dan hanya dapat digunakan untuk \nkepentingan sosial. Apa yang dimaksud dengan kepentingan sosial? \nPasal 153 ayat (6) UU PPSK mengatur bahwa sanksi (ta’zir) akan diatur \ndalam POJK. Yang dimaksud dengan kepentingan sosial adalah segala']",SWDKLLJ dipungut dari para pengusaha/pemilik angkutan lalu lintas jalan.,0.5,0.8050787180755127,0.9999999999666667,1.0,0.9317483833882366,0.9829370958470591,0
Berapa yang dipungut untuk sepeda motor di bawah 50cc?,"Rp 20.000,00 (dua puluh ribu rupiah)

Source: [36/PMK.010/2008](https://www.ojk.go.id/id/regulasi/Documents/Pages/PMK-Nomor-36PMK.010-Tahun-2008-tentang-Besar-Santunan-dan-Sumbangan-Wajib-Dana-Kecelakaan-Lalu-Lintas-Jalan/menas13_1389258036.pdf#page=4)","['MENTERI KEUANGAN\nREPUBLIK INDONESIA\nmemperoleh santunan sebesar Rp 25.000.000,00 (dua puluh lima\njuta rupiah).\nb. Korban yang mengalami cacat tetap berhak memperoleh\nsantunan yang besarnya dihitung berdasarkan angka prosentase\n Korban yang memerlukan perawatan dan pengobatan berhak\nrupiah).\nPasal 3\nDalam hal korban meninggal dunia akibat kecelakaan alat angkutan\nlalu lintas jalan tidak mempunyai ahli waris, kepada pihak yang\nmenyelenggarakan\ndiberikan\npenggantian\nbiaya\nPasal 4\n(2) Besar SWDKLLJ sebagaimana dimaksud pada ayat (1) ditentukan\nsebagai berikut:\nSepeda motor di bawah 50 cc, mobil ambulance, mobil jenazah\na.\ndan mobil pemadam kebakaran dibebaskan dari kewajiban\nb. Traktor, buidozer, forklift, mobil derek, excavator, crane dan\nsejenisnya sebesar Rp 20.000,00 (dua puluh ribu rupiah):\n Sepeda motor, sepeda kumbang dan scooter di atas 50 cc sampai\n250 cc dan kendaraan bermotor roda tiga sebesar Rp 32.000,00\n(tiga puluh dua ribu rupiah).\nd.'
 'Sepeda motor, sepeda kumbang dan scooter di atas 50 cc sampai\n250 cc dan kendaraan bermotor roda tiga sebesar Rp 32.000,00\n(tiga puluh dua ribu rupiah).\nd.\nPick up/mobil barang sampai dengan 2400 cc, sedan, jeep dan\n mobil penumpang bukan angkutan umum sebesar Rp140.000,00\n(seratus empat puluh ribu rupiah).'
 'MENTERI KEUANGAN\nREPUBLIK INDONESIA\n-4-\n Mobil penumpang angkutan umum sampai dengan 1600 cc\ng. Bus dan mikro bus bukan angkutan umum sebesar Rp150.000,00\n(seratus lima puluh ribu rupiah).\nh. Bus dan.mikro bus angkutan umum, serta mobil penumpang\nangkutan umum lainnya di atas 1600 cc sebesar Rp87.000,00\n(delapan puluh tujuh ribu rupiah).\nTruk, mobil tangki, mobil gandengan, mobil barang di atas 2400\ncc, truk container dan sejenisnya sebesar Rp 160.000,00 (seratus\n enam puluh ribu rupiah).\nPasal 5\nSetiap jenis kendaraan sebagaimana dimaksud dalam Pasal 4, dikenakan\nbiaya\n penggantian pembuatan\n Kartu Dana/Sertifikat sebesar\nRp 3.000,00 (tiga ribu rupiah).\nPasal 6\nTanda Nomor Kendaraan Bermotor sesuai dengan ketentuan\nperaturan perundang-undangan yang berlaku.\n2) Dalam hal pembayaran SWDKLLJ dilakukan setelah melewati batas\n seharusnya dibayar dengan ketentuan denda yang dikenakan paling\nbesar Rp100.000,00 (seratus ribu rupiah).'
 'wajib\nsebagaimana dimaksud dalam Undang-Undang Nomor 34 Tahun\n1964 tentang Dana Kecelakaan Lalu Lintas Jalan juncto Peraturan\nPelaksanaan Dana Kecelakaan Lalu Lintas Jalan.\n2) SWDKLLJ merupakan premi asuransi yang dibayarkan oleh para\npengusaha/pemilik alat angkutan lalu lintas jalan kepada\nperusahaan yang menyelenggarakan Dana Kecelakaan Lalu Lintas\nJalan.\nPasal 2\n(1 Korban kecelakaan alat angkutan lalu lintas jalan atau ahli warisnya\nberhak atas santunan.\nBesar santunan sebagaimana dimaksud pada ayat (1) ditentukan\nsebagai berikut:'
 '2) Dalam hal pembayaran SWDKLLJ dilakukan setelah melewati batas\n seharusnya dibayar dengan ketentuan denda yang dikenakan paling\nbesar Rp100.000,00 (seratus ribu rupiah).\n(3) Dalam hal ketentuan mengenai batas waktu sebagaimana dimaksud\ngeografis daerah setempat, Direksi perusahaan yang ditunjuk untuk\nmenyelenggarakan Dana Kecelakaan Lalu Lintas Jalan diberi\nbesarnya denda SWDKLLJ, dengan ketentuan batas waktu dimaksud\npaling lama 15 (lima belas) hari kerja.'
 'REPUBLIK INDONESIA\n Penyelenggaraan Usaha Perasuransian (Lembaran Negara Republik\nIndonesia Tahun 1992 Nomor 120, Tambahan Lembaran Negara\nRepublik Indonesia Nomor 3506) sebagaimana telah diubah dengan\nPeraturan Pemerintah Nomor 63 .Tahun 1999 (Lembaran Negara\nNegara Republik Indonesia Nomor 3861);\n Keputusan Presiden Nomor 20/P Tahun 2005j\n Keputusan Menteri Keuangan Nomor 337/KMK.011/1981 tentang\nPenunjukan Perusahaan Perseroan (Persero) Asuransi Kerugian Jasa\nRaharja untuk\n menyelenggarakan Dana Pertanggungan Wajib\nKecelakaan Penumpang dan Dana Kecelakaan Lalu Lintas Jalan;\nMEMUTUSKAN:\nMenetapkan : PERATURAN\nMENTERI\nKEUANGAN\nTENTANG\nBESAR\nLALU LINTAS JALAN\nPasal 1\n(1) Sumbangan Wajib Dana Kecelakaan Lalu Lintas Jalan,\nselanjutnya\n disebut SWDKLLJ, adalah sumbangan\nwajib\nsebagaimana dimaksud dalam Undang-Undang Nomor 34 Tahun\n1964 tentang Dana Kecelakaan Lalu Lintas Jalan juncto Peraturan\nPelaksanaan Dana Kecelakaan Lalu Lintas Jalan.']","Sepeda motor di bawah 50cc, mobil ambulance, mobil jenazah, dan mobil pemadam kebakaran dibebaskan dari kewajiban membayar SWDKLLJ.",,0.8156786554772423,0.9999999999,1.0,0.8244832619518608,0.20614992174793095,0
Kalau traktor?,"Besar SWDKLLJ untuk traktor adalah Rp 20.000,00 (dua puluh ribu rupiah).

Source: [36/PMK.010/2008](https://www.ojk.go.id/id/regulasi/Documents/Pages/PMK-Nomor-36PMK.010-Tahun-2008-tentang-Besar-Santunan-dan-Sumbangan-Wajib-Dana-Kecelakaan-Lalu-Lintas-Jalan/menas13_1389258036.pdf#page=4)","['MENTERI KEUANGAN\nREPUBLIK INDONESIA\nmemperoleh santunan sebesar Rp 25.000.000,00 (dua puluh lima\njuta rupiah).\nb. Korban yang mengalami cacat tetap berhak memperoleh\nsantunan yang besarnya dihitung berdasarkan angka prosentase\n Korban yang memerlukan perawatan dan pengobatan berhak\nrupiah).\nPasal 3\nDalam hal korban meninggal dunia akibat kecelakaan alat angkutan\nlalu lintas jalan tidak mempunyai ahli waris, kepada pihak yang\nmenyelenggarakan\ndiberikan\npenggantian\nbiaya\nPasal 4\n(2) Besar SWDKLLJ sebagaimana dimaksud pada ayat (1) ditentukan\nsebagai berikut:\nSepeda motor di bawah 50 cc, mobil ambulance, mobil jenazah\na.\ndan mobil pemadam kebakaran dibebaskan dari kewajiban\nb. Traktor, buidozer, forklift, mobil derek, excavator, crane dan\nsejenisnya sebesar Rp 20.000,00 (dua puluh ribu rupiah):\n Sepeda motor, sepeda kumbang dan scooter di atas 50 cc sampai\n250 cc dan kendaraan bermotor roda tiga sebesar Rp 32.000,00\n(tiga puluh dua ribu rupiah).\nd.'
 'wajib\nsebagaimana dimaksud dalam Undang-Undang Nomor 34 Tahun\n1964 tentang Dana Kecelakaan Lalu Lintas Jalan juncto Peraturan\nPelaksanaan Dana Kecelakaan Lalu Lintas Jalan.\n2) SWDKLLJ merupakan premi asuransi yang dibayarkan oleh para\npengusaha/pemilik alat angkutan lalu lintas jalan kepada\nperusahaan yang menyelenggarakan Dana Kecelakaan Lalu Lintas\nJalan.\nPasal 2\n(1 Korban kecelakaan alat angkutan lalu lintas jalan atau ahli warisnya\nberhak atas santunan.\nBesar santunan sebagaimana dimaksud pada ayat (1) ditentukan\nsebagai berikut:'
 '2) Dalam hal pembayaran SWDKLLJ dilakukan setelah melewati batas\n seharusnya dibayar dengan ketentuan denda yang dikenakan paling\nbesar Rp100.000,00 (seratus ribu rupiah).\n(3) Dalam hal ketentuan mengenai batas waktu sebagaimana dimaksud\ngeografis daerah setempat, Direksi perusahaan yang ditunjuk untuk\nmenyelenggarakan Dana Kecelakaan Lalu Lintas Jalan diberi\nbesarnya denda SWDKLLJ, dengan ketentuan batas waktu dimaksud\npaling lama 15 (lima belas) hari kerja.'
 'REPUBLIK INDONESIA\n Penyelenggaraan Usaha Perasuransian (Lembaran Negara Republik\nIndonesia Tahun 1992 Nomor 120, Tambahan Lembaran Negara\nRepublik Indonesia Nomor 3506) sebagaimana telah diubah dengan\nPeraturan Pemerintah Nomor 63 .Tahun 1999 (Lembaran Negara\nNegara Republik Indonesia Nomor 3861);\n Keputusan Presiden Nomor 20/P Tahun 2005j\n Keputusan Menteri Keuangan Nomor 337/KMK.011/1981 tentang\nPenunjukan Perusahaan Perseroan (Persero) Asuransi Kerugian Jasa\nRaharja untuk\n menyelenggarakan Dana Pertanggungan Wajib\nKecelakaan Penumpang dan Dana Kecelakaan Lalu Lintas Jalan;\nMEMUTUSKAN:\nMenetapkan : PERATURAN\nMENTERI\nKEUANGAN\nTENTANG\nBESAR\nLALU LINTAS JALAN\nPasal 1\n(1) Sumbangan Wajib Dana Kecelakaan Lalu Lintas Jalan,\nselanjutnya\n disebut SWDKLLJ, adalah sumbangan\nwajib\nsebagaimana dimaksud dalam Undang-Undang Nomor 34 Tahun\n1964 tentang Dana Kecelakaan Lalu Lintas Jalan juncto Peraturan\nPelaksanaan Dana Kecelakaan Lalu Lintas Jalan.'
 'MENTERI KEUANGAN\nREPUBLIK INDONESIA\n-4-\n Mobil penumpang angkutan umum sampai dengan 1600 cc\ng. Bus dan mikro bus bukan angkutan umum sebesar Rp150.000,00\n(seratus lima puluh ribu rupiah).\nh. Bus dan.mikro bus angkutan umum, serta mobil penumpang\nangkutan umum lainnya di atas 1600 cc sebesar Rp87.000,00\n(delapan puluh tujuh ribu rupiah).\nTruk, mobil tangki, mobil gandengan, mobil barang di atas 2400\ncc, truk container dan sejenisnya sebesar Rp 160.000,00 (seratus\n enam puluh ribu rupiah).\nPasal 5\nSetiap jenis kendaraan sebagaimana dimaksud dalam Pasal 4, dikenakan\nbiaya\n penggantian pembuatan\n Kartu Dana/Sertifikat sebesar\nRp 3.000,00 (tiga ribu rupiah).\nPasal 6\nTanda Nomor Kendaraan Bermotor sesuai dengan ketentuan\nperaturan perundang-undangan yang berlaku.\n2) Dalam hal pembayaran SWDKLLJ dilakukan setelah melewati batas\n seharusnya dibayar dengan ketentuan denda yang dikenakan paling\nbesar Rp100.000,00 (seratus ribu rupiah).'
 'hutang kepada negara yang harus dicantumkan dalam neraca pcrusahaan yang \nbersangkutan. \n \nPasal 40 \n \nPerusahaan Perasuransian yang telah dikenakan denda selama 90 (sembilan puluh) hari \nketerlambatan tetapi belum juga menyampaikan laporan sebagaimana dimaksud dalam Pasal 38, \ndengan tidak membebaskan kewajiban membayar denda yang telah dikenakan untuk jangka 90 \n(sembilan puluh) hari termaksud, dikenakan sanksi pembatasan kegiatan usaha.']","Traktor, buldozer, forklift, mobil derek, excavator, crane dan sejenisnya sebesar Rp 20.000,00 (dua puluh ribu rupiah).",1.0,0.8789594761808176,0.9999999999,1.0,0.8942768972974675,0.22356922432436688,0
Kendaraan apa yang memiliki SWDKLLJ terbesar?,"Kendaraan yang memiliki SWDKLLJ terbesar adalah truk, mobil tangki, mobil gandengan, mobil barang di atas 2400 cc, truk container dan sejenisnya.

Source: [36/PMK.010/2008](https://www.ojk.go.id/id/regulasi/Documents/Pages/PMK-Nomor-36PMK.010-Tahun-2008-tentang-Besar-Santunan-dan-Sumbangan-Wajib-Dana-Kecelakaan-Lalu-Lintas-Jalan/menas13_1389258036.pdf#page=4)","['MENTERI KEUANGAN\nREPUBLIK INDONESIA\nmemperoleh santunan sebesar Rp 25.000.000,00 (dua puluh lima\njuta rupiah).\nb. Korban yang mengalami cacat tetap berhak memperoleh\nsantunan yang besarnya dihitung berdasarkan angka prosentase\n Korban yang memerlukan perawatan dan pengobatan berhak\nrupiah).\nPasal 3\nDalam hal korban meninggal dunia akibat kecelakaan alat angkutan\nlalu lintas jalan tidak mempunyai ahli waris, kepada pihak yang\nmenyelenggarakan\ndiberikan\npenggantian\nbiaya\nPasal 4\n(2) Besar SWDKLLJ sebagaimana dimaksud pada ayat (1) ditentukan\nsebagai berikut:\nSepeda motor di bawah 50 cc, mobil ambulance, mobil jenazah\na.\ndan mobil pemadam kebakaran dibebaskan dari kewajiban\nb. Traktor, buidozer, forklift, mobil derek, excavator, crane dan\nsejenisnya sebesar Rp 20.000,00 (dua puluh ribu rupiah):\n Sepeda motor, sepeda kumbang dan scooter di atas 50 cc sampai\n250 cc dan kendaraan bermotor roda tiga sebesar Rp 32.000,00\n(tiga puluh dua ribu rupiah).\nd.'
 'wajib\nsebagaimana dimaksud dalam Undang-Undang Nomor 34 Tahun\n1964 tentang Dana Kecelakaan Lalu Lintas Jalan juncto Peraturan\nPelaksanaan Dana Kecelakaan Lalu Lintas Jalan.\n2) SWDKLLJ merupakan premi asuransi yang dibayarkan oleh para\npengusaha/pemilik alat angkutan lalu lintas jalan kepada\nperusahaan yang menyelenggarakan Dana Kecelakaan Lalu Lintas\nJalan.\nPasal 2\n(1 Korban kecelakaan alat angkutan lalu lintas jalan atau ahli warisnya\nberhak atas santunan.\nBesar santunan sebagaimana dimaksud pada ayat (1) ditentukan\nsebagai berikut:'
 '2) Dalam hal pembayaran SWDKLLJ dilakukan setelah melewati batas\n seharusnya dibayar dengan ketentuan denda yang dikenakan paling\nbesar Rp100.000,00 (seratus ribu rupiah).\n(3) Dalam hal ketentuan mengenai batas waktu sebagaimana dimaksud\ngeografis daerah setempat, Direksi perusahaan yang ditunjuk untuk\nmenyelenggarakan Dana Kecelakaan Lalu Lintas Jalan diberi\nbesarnya denda SWDKLLJ, dengan ketentuan batas waktu dimaksud\npaling lama 15 (lima belas) hari kerja.'
 'MENTERI KEUANGAN\nREPUBLIK INDONESIA\n-4-\n Mobil penumpang angkutan umum sampai dengan 1600 cc\ng. Bus dan mikro bus bukan angkutan umum sebesar Rp150.000,00\n(seratus lima puluh ribu rupiah).\nh. Bus dan.mikro bus angkutan umum, serta mobil penumpang\nangkutan umum lainnya di atas 1600 cc sebesar Rp87.000,00\n(delapan puluh tujuh ribu rupiah).\nTruk, mobil tangki, mobil gandengan, mobil barang di atas 2400\ncc, truk container dan sejenisnya sebesar Rp 160.000,00 (seratus\n enam puluh ribu rupiah).\nPasal 5\nSetiap jenis kendaraan sebagaimana dimaksud dalam Pasal 4, dikenakan\nbiaya\n penggantian pembuatan\n Kartu Dana/Sertifikat sebesar\nRp 3.000,00 (tiga ribu rupiah).\nPasal 6\nTanda Nomor Kendaraan Bermotor sesuai dengan ketentuan\nperaturan perundang-undangan yang berlaku.\n2) Dalam hal pembayaran SWDKLLJ dilakukan setelah melewati batas\n seharusnya dibayar dengan ketentuan denda yang dikenakan paling\nbesar Rp100.000,00 (seratus ribu rupiah).'
 'REPUBLIK INDONESIA\n Penyelenggaraan Usaha Perasuransian (Lembaran Negara Republik\nIndonesia Tahun 1992 Nomor 120, Tambahan Lembaran Negara\nRepublik Indonesia Nomor 3506) sebagaimana telah diubah dengan\nPeraturan Pemerintah Nomor 63 .Tahun 1999 (Lembaran Negara\nNegara Republik Indonesia Nomor 3861);\n Keputusan Presiden Nomor 20/P Tahun 2005j\n Keputusan Menteri Keuangan Nomor 337/KMK.011/1981 tentang\nPenunjukan Perusahaan Perseroan (Persero) Asuransi Kerugian Jasa\nRaharja untuk\n menyelenggarakan Dana Pertanggungan Wajib\nKecelakaan Penumpang dan Dana Kecelakaan Lalu Lintas Jalan;\nMEMUTUSKAN:\nMenetapkan : PERATURAN\nMENTERI\nKEUANGAN\nTENTANG\nBESAR\nLALU LINTAS JALAN\nPasal 1\n(1) Sumbangan Wajib Dana Kecelakaan Lalu Lintas Jalan,\nselanjutnya\n disebut SWDKLLJ, adalah sumbangan\nwajib\nsebagaimana dimaksud dalam Undang-Undang Nomor 34 Tahun\n1964 tentang Dana Kecelakaan Lalu Lintas Jalan juncto Peraturan\nPelaksanaan Dana Kecelakaan Lalu Lintas Jalan.'
 'Sepeda motor, sepeda kumbang dan scooter di atas 50 cc sampai\n250 cc dan kendaraan bermotor roda tiga sebesar Rp 32.000,00\n(tiga puluh dua ribu rupiah).\nd.\nPick up/mobil barang sampai dengan 2400 cc, sedan, jeep dan\n mobil penumpang bukan angkutan umum sebesar Rp140.000,00\n(seratus empat puluh ribu rupiah).']","Truk, mobil tangki, mobil gandengan, mobil barang di atas 2400 cc, truk container dan sejenisnya.",0.2,0.999998738256347,0.8874999999778125,1.0,0.8982071139062714,0.9745517784765678,0
Berapa nilainya?,"SWDKLLJ untuk kendaraan yang memiliki SWDKLLJ terbesar adalah Rp 160.000,00 (seratus enam puluh ribu rupiah).

Source: [36/PMK.010/2008](https://www.ojk.go.id/id/regulasi/Documents/Pages/PMK-Nomor-36PMK.010-Tahun-2008-tentang-Besar-Santunan-dan-Sumbangan-Wajib-Dana-Kecelakaan-Lalu-Lintas-Jalan/menas13_1389258036.pdf#page=4)","['MENTERI KEUANGAN\nREPUBLIK INDONESIA\nmemperoleh santunan sebesar Rp 25.000.000,00 (dua puluh lima\njuta rupiah).\nb. Korban yang mengalami cacat tetap berhak memperoleh\nsantunan yang besarnya dihitung berdasarkan angka prosentase\n Korban yang memerlukan perawatan dan pengobatan berhak\nrupiah).\nPasal 3\nDalam hal korban meninggal dunia akibat kecelakaan alat angkutan\nlalu lintas jalan tidak mempunyai ahli waris, kepada pihak yang\nmenyelenggarakan\ndiberikan\npenggantian\nbiaya\nPasal 4\n(2) Besar SWDKLLJ sebagaimana dimaksud pada ayat (1) ditentukan\nsebagai berikut:\nSepeda motor di bawah 50 cc, mobil ambulance, mobil jenazah\na.\ndan mobil pemadam kebakaran dibebaskan dari kewajiban\nb. Traktor, buidozer, forklift, mobil derek, excavator, crane dan\nsejenisnya sebesar Rp 20.000,00 (dua puluh ribu rupiah):\n Sepeda motor, sepeda kumbang dan scooter di atas 50 cc sampai\n250 cc dan kendaraan bermotor roda tiga sebesar Rp 32.000,00\n(tiga puluh dua ribu rupiah).\nd.'
 '2) Dalam hal pembayaran SWDKLLJ dilakukan setelah melewati batas\n seharusnya dibayar dengan ketentuan denda yang dikenakan paling\nbesar Rp100.000,00 (seratus ribu rupiah).\n(3) Dalam hal ketentuan mengenai batas waktu sebagaimana dimaksud\ngeografis daerah setempat, Direksi perusahaan yang ditunjuk untuk\nmenyelenggarakan Dana Kecelakaan Lalu Lintas Jalan diberi\nbesarnya denda SWDKLLJ, dengan ketentuan batas waktu dimaksud\npaling lama 15 (lima belas) hari kerja.'
 'MENTERI KEUANGAN\nREPUBLIK INDONESIA\n-4-\n Mobil penumpang angkutan umum sampai dengan 1600 cc\ng. Bus dan mikro bus bukan angkutan umum sebesar Rp150.000,00\n(seratus lima puluh ribu rupiah).\nh. Bus dan.mikro bus angkutan umum, serta mobil penumpang\nangkutan umum lainnya di atas 1600 cc sebesar Rp87.000,00\n(delapan puluh tujuh ribu rupiah).\nTruk, mobil tangki, mobil gandengan, mobil barang di atas 2400\ncc, truk container dan sejenisnya sebesar Rp 160.000,00 (seratus\n enam puluh ribu rupiah).\nPasal 5\nSetiap jenis kendaraan sebagaimana dimaksud dalam Pasal 4, dikenakan\nbiaya\n penggantian pembuatan\n Kartu Dana/Sertifikat sebesar\nRp 3.000,00 (tiga ribu rupiah).\nPasal 6\nTanda Nomor Kendaraan Bermotor sesuai dengan ketentuan\nperaturan perundang-undangan yang berlaku.\n2) Dalam hal pembayaran SWDKLLJ dilakukan setelah melewati batas\n seharusnya dibayar dengan ketentuan denda yang dikenakan paling\nbesar Rp100.000,00 (seratus ribu rupiah).'
 'wajib\nsebagaimana dimaksud dalam Undang-Undang Nomor 34 Tahun\n1964 tentang Dana Kecelakaan Lalu Lintas Jalan juncto Peraturan\nPelaksanaan Dana Kecelakaan Lalu Lintas Jalan.\n2) SWDKLLJ merupakan premi asuransi yang dibayarkan oleh para\npengusaha/pemilik alat angkutan lalu lintas jalan kepada\nperusahaan yang menyelenggarakan Dana Kecelakaan Lalu Lintas\nJalan.\nPasal 2\n(1 Korban kecelakaan alat angkutan lalu lintas jalan atau ahli warisnya\nberhak atas santunan.\nBesar santunan sebagaimana dimaksud pada ayat (1) ditentukan\nsebagai berikut:'
 'REPUBLIK INDONESIA\n Penyelenggaraan Usaha Perasuransian (Lembaran Negara Republik\nIndonesia Tahun 1992 Nomor 120, Tambahan Lembaran Negara\nRepublik Indonesia Nomor 3506) sebagaimana telah diubah dengan\nPeraturan Pemerintah Nomor 63 .Tahun 1999 (Lembaran Negara\nNegara Republik Indonesia Nomor 3861);\n Keputusan Presiden Nomor 20/P Tahun 2005j\n Keputusan Menteri Keuangan Nomor 337/KMK.011/1981 tentang\nPenunjukan Perusahaan Perseroan (Persero) Asuransi Kerugian Jasa\nRaharja untuk\n menyelenggarakan Dana Pertanggungan Wajib\nKecelakaan Penumpang dan Dana Kecelakaan Lalu Lintas Jalan;\nMEMUTUSKAN:\nMenetapkan : PERATURAN\nMENTERI\nKEUANGAN\nTENTANG\nBESAR\nLALU LINTAS JALAN\nPasal 1\n(1) Sumbangan Wajib Dana Kecelakaan Lalu Lintas Jalan,\nselanjutnya\n disebut SWDKLLJ, adalah sumbangan\nwajib\nsebagaimana dimaksud dalam Undang-Undang Nomor 34 Tahun\n1964 tentang Dana Kecelakaan Lalu Lintas Jalan juncto Peraturan\nPelaksanaan Dana Kecelakaan Lalu Lintas Jalan.'
 'Sepeda motor, sepeda kumbang dan scooter di atas 50 cc sampai\n250 cc dan kendaraan bermotor roda tiga sebesar Rp 32.000,00\n(tiga puluh dua ribu rupiah).\nd.\nPick up/mobil barang sampai dengan 2400 cc, sedan, jeep dan\n mobil penumpang bukan angkutan umum sebesar Rp140.000,00\n(seratus empat puluh ribu rupiah).']","Rp 160.000,00.",0.0,0.7396671389632902,0.249999999975,1.0,0.8115613469612545,0.7028903367403136,0
Apakah kendaraan-kendaraan tersebut dikenakan biaya penggantian pembuatan Kartu Dana/Sertifikat?,"Ya, kendaraan-kendaraan tersebut dikenakan biaya penggantian pembuatan Kartu Dana/Sertifikat. 

Source: [36/PMK.010/2008](https://www.ojk.go.id/id/regulasi/Documents/Pages/PMK-Nomor-36PMK.010-Tahun-2008-tentang-Besar-Santunan-dan-Sumbangan-Wajib-Dana-Kecelakaan-Lalu-Lintas-Jalan/menas13_1389258036.pdf#page=4)","['MENTERI KEUANGAN\nREPUBLIK INDONESIA\n-4-\n Mobil penumpang angkutan umum sampai dengan 1600 cc\ng. Bus dan mikro bus bukan angkutan umum sebesar Rp150.000,00\n(seratus lima puluh ribu rupiah).\nh. Bus dan.mikro bus angkutan umum, serta mobil penumpang\nangkutan umum lainnya di atas 1600 cc sebesar Rp87.000,00\n(delapan puluh tujuh ribu rupiah).\nTruk, mobil tangki, mobil gandengan, mobil barang di atas 2400\ncc, truk container dan sejenisnya sebesar Rp 160.000,00 (seratus\n enam puluh ribu rupiah).\nPasal 5\nSetiap jenis kendaraan sebagaimana dimaksud dalam Pasal 4, dikenakan\nbiaya\n penggantian pembuatan\n Kartu Dana/Sertifikat sebesar\nRp 3.000,00 (tiga ribu rupiah).\nPasal 6\nTanda Nomor Kendaraan Bermotor sesuai dengan ketentuan\nperaturan perundang-undangan yang berlaku.\n2) Dalam hal pembayaran SWDKLLJ dilakukan setelah melewati batas\n seharusnya dibayar dengan ketentuan denda yang dikenakan paling\nbesar Rp100.000,00 (seratus ribu rupiah).'
 'PREMI MURNI SERTA UNSUR BIAYA ADMINISTRASI DAN \nBIAYA UMUM LAINNYA PADA LINI USAHA ASURANSI \nKENDARAAN BERMOTOR TAHUN 2010.  \nPasal 1 \nReferensi unsur premi murni pada lini usaha asuransi kendaraan \nbermotor yang dapat digunakan oleh Perusahaan Asuransi Umum \nsebagaimana dimaksud dalam Pasal 3 ayat (1) Peraturan Menteri \nKeuangan Republik Indonesia Nomor 74/PMK.010/2007 tentang \nPenyelenggaraan Pertanggungan Asuransi Pada Lini Usaha Asuransi \nKendaraan \nBermotor \nadalah \nsebagaimana \ntercantum \ndalam \nLampiran 1 Peraturan Ketua Badan Pengawas Pasar Modal dan \nLembaga Keuangan ini. \nPasal 2 \n(1) Perusahaan asuransi umum yang memiliki data profil risiko dan \nkerugian untuk periode 5 (lima) tahun atau lebih wajib \nmenggunakan data sendiri dalam menetapkan tarif premi murni, \ndengan memperhitungkan faktor kredibilitas. \n(2) Penggunaan faktor kredibilitas dalam penetapan tarif premi \nmurni dilakukan dengan tata cara dan formula sebagaimana'
 'MENTERI KEUANGAN\nREPUBLIK INDONESIA\nPasal 7\nDalam hal Pemerintah Daerah melakukan pembebasan terhadap Pajak\nperusahaan yang ditunjuk untuk menyelenggarakan Dana Kecelakaan\nLalu Lintas Jalan dapat menetapkan kebijakan pembebasan pembayaran\nSWDKLLJ, Kartu Dana/Sertifikat, dan besar denda SWDKLLJ yang\ntertunggak untuk tahun yang lewat, dengan mempertimbangkan\nkebijakan Pemerintah Daerah setempat.\nPasal 8\nPada saat Peraturan Menteri Keuangan ini mulai berlaku, Keputusan\nMenteri Keuangan Nomor 416/KMK.06/2001 tentang Penetapan\nSantunan dan Sumbangan Wajib Dana Kecelakaan Lalu Lintas Jalan,\ndicabut dan dinyatakan tidak berlaku.\nPasal 9\nPeraturan Menteri Keuangan ini mulai berlaku setelah 30 (tiga puluh\nhari sejak tanggal ditetapkan.\nPeraturan Menteri Keuangan ini dengan penempatannya dalam Berita\nNegara Republik Indonesia.\nDitetapkan di Jakarta\npada tanggal 26 Februari 2008\nMENTERI KEUANGAN\nttd\nSalinan sesuai dengan aslinya\nSRI MULYANI INDRAWATI\nn Tata Usaha Departemen'
 'DAN BIAYA UMUM LAINNYA PADA LINI USAHA ASURANSI  \nKENDARAAN BERMOTOR TAHUN 2010  \n \nKETUA BADAN PENGAWAS PASAR MODAL  \nDAN LEMBAGA KEUANGAN,  \n \nMenimbang : \na. bahwa berdasarkan Pasal 3 ayat (3) Peraturan Menteri \nKeuangan Nomor 74/PMK.010/2007 tentang Penyelenggaraan \nPertanggungan Asuransi Pada Lini Usaha Asuransi Kendaraan \nBermotor, referensi unsur premi murni serta unsur biaya \nadministrasi dan biaya umum lainnya perlu ditinjau setiap \ntahun dan perubahannya ditetapkan oleh Ketua Badan \nPengawas Pasar Modal dan Lembaga Keuangan; \nb. bahwa berdasarkan pertimbangan sebagaimana dimaksud pada \nhuruf a, perlu untuk menetapkan referensi unsur premi serta \nunsur biaya administrasi dan biaya umum lainnya yang baru \ndengan Peraturan Ketua Badan Pengawas Pasar Modal dan \nLembaga Keuangan;  \nMengingat \n: \n1. Undang-undang \nNomor \n2 \nTahun \n1992 \ntentang \nUsaha \nPerasuransian (Lembaran Negara Republik Indonesia Tahun \n1992 Nomor 13, Tambahan Lembaran Negara Nomor 3467); \n2. Peraturan'
 'Kendaraan Bermotor dihitung dengan menggunakan referensi unsur \npremi murni sesuai Lampiran 1  Peraturan Ketua Badan Pengawas \nPasar Modal dan Lembaga Keuangan ini. \nPasal 5 \nPeraturan Ketua Badan Pengawas Pasar Modal dan Lembaga \nKeuangan Nomor PER-06/BL/2008 tentang Referensi Unsur Premi \nMurni Serta Unsur Biaya Administrasi Dan Biaya Umum Lainnya \nPada Lini Usaha Asuransi Kendaraan Bermotor Tahun 2008 - 2009 \nberlaku sampai dengan tanggal 28 Februari 2010. \nPasal 6 \nPeraturan Ketua Badan Pengawas Pasar Modal dan Lembaga \nKeuangan ini mulai berlaku pada tanggal 1 Maret 2010. \nAgar setiap orang mengetahuinya, memerintahkan pengumuman \nPeraturan Ketua Badan Pengawas Pasar Modal dan Lembaga \nKeuangan ini dengan penempatannya dalam Berita Negara Republik \nIndonesia.  \n \nDitetapkan di \n:  Jakarta \npada tanggal \n:  31 Desember  2009 \n \n \n \nSalinan sesuai dengan aslinya \nKepala Bagian Umum \n \nttd. \n \nPrasetyo Wahyu Adi Suryo  \nNIP 060076008 \nKetua Badan Pengawas Pasar Modal'
 'MENTERI KEUANGAN\nREPUBLIK INDONESIA\nmemperoleh santunan sebesar Rp 25.000.000,00 (dua puluh lima\njuta rupiah).\nb. Korban yang mengalami cacat tetap berhak memperoleh\nsantunan yang besarnya dihitung berdasarkan angka prosentase\n Korban yang memerlukan perawatan dan pengobatan berhak\nrupiah).\nPasal 3\nDalam hal korban meninggal dunia akibat kecelakaan alat angkutan\nlalu lintas jalan tidak mempunyai ahli waris, kepada pihak yang\nmenyelenggarakan\ndiberikan\npenggantian\nbiaya\nPasal 4\n(2) Besar SWDKLLJ sebagaimana dimaksud pada ayat (1) ditentukan\nsebagai berikut:\nSepeda motor di bawah 50 cc, mobil ambulance, mobil jenazah\na.\ndan mobil pemadam kebakaran dibebaskan dari kewajiban\nb. Traktor, buidozer, forklift, mobil derek, excavator, crane dan\nsejenisnya sebesar Rp 20.000,00 (dua puluh ribu rupiah):\n Sepeda motor, sepeda kumbang dan scooter di atas 50 cc sampai\n250 cc dan kendaraan bermotor roda tiga sebesar Rp 32.000,00\n(tiga puluh dua ribu rupiah).\nd.']","Ya, setiap jenis kendaraan sebagaimana dimaksud dalam Pasal 4, dikenakan biaya penggantian pembuatan Kartu Dana/Sertifikat sebesar Rp 3.000,00.",1.0,0.9999999999999994,0.9999999999833333,1.0,0.9388608544771686,0.7347152136192922,0
Apa judul peraturan yang membahas tentang SWDKLLJ tersebut?,"Peraturan Menteri Keuangan Nomor 36/PMK.010/2008 tentang Besar Santunan dan Sumbangan Wajib Dana Kecelakaan Lalu Lintas Jalan

Source: [36/PMK.010/2008](https://www.ojk.go.id/id/regulasi/Documents/Pages/PMK-Nomor-36PMK.010-Tahun-2008-tentang-Besar-Santunan-dan-Sumbangan-Wajib-Dana-Kecelakaan-Lalu-Lintas-Jalan/menas13_1389258036.pdf)","['wajib\nsebagaimana dimaksud dalam Undang-Undang Nomor 34 Tahun\n1964 tentang Dana Kecelakaan Lalu Lintas Jalan juncto Peraturan\nPelaksanaan Dana Kecelakaan Lalu Lintas Jalan.\n2) SWDKLLJ merupakan premi asuransi yang dibayarkan oleh para\npengusaha/pemilik alat angkutan lalu lintas jalan kepada\nperusahaan yang menyelenggarakan Dana Kecelakaan Lalu Lintas\nJalan.\nPasal 2\n(1 Korban kecelakaan alat angkutan lalu lintas jalan atau ahli warisnya\nberhak atas santunan.\nBesar santunan sebagaimana dimaksud pada ayat (1) ditentukan\nsebagai berikut:'
 'REPUBLIK INDONESIA\n Penyelenggaraan Usaha Perasuransian (Lembaran Negara Republik\nIndonesia Tahun 1992 Nomor 120, Tambahan Lembaran Negara\nRepublik Indonesia Nomor 3506) sebagaimana telah diubah dengan\nPeraturan Pemerintah Nomor 63 .Tahun 1999 (Lembaran Negara\nNegara Republik Indonesia Nomor 3861);\n Keputusan Presiden Nomor 20/P Tahun 2005j\n Keputusan Menteri Keuangan Nomor 337/KMK.011/1981 tentang\nPenunjukan Perusahaan Perseroan (Persero) Asuransi Kerugian Jasa\nRaharja untuk\n menyelenggarakan Dana Pertanggungan Wajib\nKecelakaan Penumpang dan Dana Kecelakaan Lalu Lintas Jalan;\nMEMUTUSKAN:\nMenetapkan : PERATURAN\nMENTERI\nKEUANGAN\nTENTANG\nBESAR\nLALU LINTAS JALAN\nPasal 1\n(1) Sumbangan Wajib Dana Kecelakaan Lalu Lintas Jalan,\nselanjutnya\n disebut SWDKLLJ, adalah sumbangan\nwajib\nsebagaimana dimaksud dalam Undang-Undang Nomor 34 Tahun\n1964 tentang Dana Kecelakaan Lalu Lintas Jalan juncto Peraturan\nPelaksanaan Dana Kecelakaan Lalu Lintas Jalan.'
 'MENTERI KEUANGAN\nREPUBLIK INDONESIA\nPasal 7\nDalam hal Pemerintah Daerah melakukan pembebasan terhadap Pajak\nperusahaan yang ditunjuk untuk menyelenggarakan Dana Kecelakaan\nLalu Lintas Jalan dapat menetapkan kebijakan pembebasan pembayaran\nSWDKLLJ, Kartu Dana/Sertifikat, dan besar denda SWDKLLJ yang\ntertunggak untuk tahun yang lewat, dengan mempertimbangkan\nkebijakan Pemerintah Daerah setempat.\nPasal 8\nPada saat Peraturan Menteri Keuangan ini mulai berlaku, Keputusan\nMenteri Keuangan Nomor 416/KMK.06/2001 tentang Penetapan\nSantunan dan Sumbangan Wajib Dana Kecelakaan Lalu Lintas Jalan,\ndicabut dan dinyatakan tidak berlaku.\nPasal 9\nPeraturan Menteri Keuangan ini mulai berlaku setelah 30 (tiga puluh\nhari sejak tanggal ditetapkan.\nPeraturan Menteri Keuangan ini dengan penempatannya dalam Berita\nNegara Republik Indonesia.\nDitetapkan di Jakarta\npada tanggal 26 Februari 2008\nMENTERI KEUANGAN\nttd\nSalinan sesuai dengan aslinya\nSRI MULYANI INDRAWATI\nn Tata Usaha Departemen'
 'Peraturan Pemerintah Nomor 81 Tahun 2008 (Lembaran \nNegara Republik Indonesia Tahun 2008 Nomor 212, \nTambahan Lembaran Negara Republik Indonesia Nomor \n4954); \n3. Peraturan Presiden Republik Indonesia Nomor 24 Tahun \n2010 \ntentang \nKedudukan, \nTugas, \nDan \nFungsi \nKementerian Negara Serta Susunan Organisasi, Tugas, \nDan Fungsi Eselon I Kementerian Negara sebagaimana \ntelah beberapa kali diubah terakhir dengan Peraturan \nPresiden Republik Indonesia Nomor 92 Tahun 2011; \n4. Peraturan Menteri Keuangan Nomor 184/PMK.01/2010 \ntentang \nOrganisasi \nDan \nTata \nKerja \nKementerian \nKeuangan; \n5. Peraturan Menteri Keuangan Republik Indonesia Nomor \n53/PMK.010/2012 \nTentang \nKesehatan \nKeuangan \nPerusahaan Asuransi Dan Perusahaan Reasuransi. \nMEMUTUSKAN: \nMenetapkan   : PERATURAN KETUA BADAN PENGAWAS PASAR MODAL \nDAN LEMBAGA KEUANGAN TENTANG LAPORAN AKTUARIS \nPERUSAHAAN ASURANSI DAN PERUSAHAAN REASURANSI. \nSALINAN'
 'menetapkan \nPeraturan \nPemerintah \nPengganti \nUndang-Undang tentang Perubahan Kedua Atas \nUndang-Undang Nomor 23 Tahun 1999 tentang \nBank Indonesia; \n \nMengingat \n: 4. \nPasal 22 ayat (1) Undang-Undang Dasar Negara \nRepublik Indonesia Tahun 1945;  \n \n \n2. Undang-Undang … \n \nLAMPIRAN \nUNDANG-UNDANG REPUBLIK INDONESIA \nNOMOR    : 6 TAHUN 2009 \nTANGGAL : 13 JANUARI 2009'
 ""metadata={'title': 'POJK tentang Investasi Surat Berharga Negara Bagi Lembaga Jasa Keuangan Non-Bank', 'sector': 'IKNB', 'subsector': 'Asuransi,  Dana Pensiun,  Lembaga Pembiayaan,  Lembaga Jasa Keuangan Khusus,  Lembaga Keuangan Mikro', 'regulation_type': 'Peraturan OJK', 'regulation_number': '1 /POJK.05/2016', 'effective_date': '12 Januari 2016', 'file_url': 'https://www.ojk.go.id/id/regulasi/Documents/Pages/POJK-01.-SBN/POJK%201-2016.pdf', 'page_number': 7}\n- 7 - \n \nAgar \nsetiap \norang \nmengetahuinya, \nmemerintahkan \npengundangan Peraturan OJK ini dengan penempatannya \ndalam Lembaran Negara Republik Indonesia. \n \n \nDitetapkan di Jakarta \npada tanggal 11 Januari 2016 \n \nKETUA DEWAN KOMISIONER  \nOTORITAS JASA KEUANGAN,  \n \n     ttd \n \n     MULIAMAN D. HADAD \n \nDiundangkan di Jakarta  \npada tanggal 12 Januari 2016 \n \nMENTERI HUKUM DAN HAK ASASI MANUSIA  \nREPUBLIK INDONESIA,  \n \nttd \n \nYASONNA H. LAOLY \n \n \nLEMBARAN NEGARA REPUBLIK INDONESIA TAHUN 2016 NOMOR 7""]",Besar Santunan dan Sumbangan Wajib Dana Kecelakaan Lalu Lintas Jalan.,0.0,0.8489546436009682,0.9999999999666667,1.0,0.9201003726486059,0.6050250931621515,0
Berapa nomor regulasi peraturan tersebut?,"Nomor regulasi dari peraturan tersebut adalah KEP-08/PM/1996.

Source: [KEP-08/PM/1996](https://www.ojk.go.id/id/regulasi/Documents/Pages/BAPEPAM-IIIB2-tentang-Tata-Cara-Pembuatan-Peraturan-oleh-Lembaga-Kliring-dan-Penjaminan/IIIB2_Tata%20Cara%20Pembuatan%20Peraturan%20oleh%20Lembaga%20Kliring%20dan%20Peminjaman.pdf)","['waktu 30 (tiga puluh) hari sejak berlakunya peraturan dimaksud dengan menggunakan\nFormulir Nomor III.B.2-6 lampiran 6 peraturan ini.\nDitetapkan di      :   Jakarta\nPada tanggal      :   17 Januari 1996\nBADAN PENGAWAS PASAR MODAL\nKetua,\nI PUTU GEDE ARY SUTA\nNIP. 060065493\nLAMPIRAN\nK e p u t u s a n  K e t u a  B a d a n\nP e n g a w a s  P a s a r  M o d a l\nNomor \n:\nKep- 08/PM/1996\nTanggal\n:\n17 Januari 1996'
 'Peraturan Pemerintah Nomor 81 Tahun 2008 (Lembaran \nNegara Republik Indonesia Tahun 2008 Nomor 212, \nTambahan Lembaran Negara Republik Indonesia Nomor \n4954); \n3. Peraturan Presiden Republik Indonesia Nomor 24 Tahun \n2010 \ntentang \nKedudukan, \nTugas, \nDan \nFungsi \nKementerian Negara Serta Susunan Organisasi, Tugas, \nDan Fungsi Eselon I Kementerian Negara sebagaimana \ntelah beberapa kali diubah terakhir dengan Peraturan \nPresiden Republik Indonesia Nomor 92 Tahun 2011; \n4. Peraturan Menteri Keuangan Nomor 184/PMK.01/2010 \ntentang \nOrganisasi \nDan \nTata \nKerja \nKementerian \nKeuangan; \n5. Peraturan Menteri Keuangan Republik Indonesia Nomor \n53/PMK.010/2012 \nTentang \nKesehatan \nKeuangan \nPerusahaan Asuransi Dan Perusahaan Reasuransi. \nMEMUTUSKAN: \nMenetapkan   : PERATURAN KETUA BADAN PENGAWAS PASAR MODAL \nDAN LEMBAGA KEUANGAN TENTANG LAPORAN AKTUARIS \nPERUSAHAAN ASURANSI DAN PERUSAHAAN REASURANSI. \nSALINAN'
 ""metadata={'title': 'Peraturan Pemerintah Republik Indonesia Nomor 63 Tahun 1999 tentang Perubahan atas Peraturan Pemerintah Nomor 73 Tahun 1992 tentang Penyelenggaraan Usaha Perasuransian', 'sector': 'IKNB', 'subsector': 'Asuransi', 'regulation_type': 'Peraturan Pemerintah', 'regulation_number': '63 TAHUN 1999', 'effective_date': '2 Juli 1999', 'file_url': 'https://www.ojk.go.id/id/regulasi/Documents/Pages/PP-RI-Nomor-63-Tahun-1999-tentang-Perubahan-atas-Peraturan-Pemerintah-Nomor-73-Tahun-1992/ppas3_1389239909.pdf', 'page_number': 13}\nCukup jelas \nAngka 13 \nPasal 42 \nAyat (1) \nCukup jelas \nPasal II \nCukup jelas \nPasal III \nCukup jelas \n  \nTAMBAHAN LEMBARAN NEGARA REPUBLIK INDONESIA NOMOR 3861""
 ""metadata={'title': 'Peraturan Bank Indonesia Nomor 6/22/PBI/2004', 'sector': 'Perbankan', 'subsector': 'Bank Umum,  BPR', 'regulation_type': 'PPBI', 'regulation_number': '6/22/PBI/2004', 'effective_date': '9 Agustus 2004', 'file_url': 'https://www.ojk.go.id/id/regulasi/Documents/Pages/Peraturan-Bank-Indonesia-Nomor-622PBI2004/324.pdf', 'page_number': 62}\n \n- 3-\nAngka 4  \nCukup jelas. \nAngka 5  \nCukup jelas. \nAngka 6 \nCukup jelas. \nAngka 7 \nCukup jelas. \nAngka 8 \nCukup jelas. \nAngka 9 \nKetentuan ini dimaksudkan agar anggota Direksi \ntidak melakukan kegiatan yang dapat menganggu \npelaksanaan tugas dan tanggung jawab sebagai \nDireksi. \nAngka 10 \nSertifikat kelulusan merupakan standar kompetensi \ndan keahlian sebagai anggota Direksi. \nAngka 11 \nCukup jelas. \n \n \nAngka 12 …""
 ""metadata={'title': 'Peraturan Bank Indonesia Nomor 6/25/PBI/2004', 'sector': 'Perbankan', 'subsector': 'Bank Umum', 'regulation_type': 'PPBI', 'regulation_number': '6/25/PBI/2004', 'effective_date': '22 Oktober 2004', 'file_url': 'https://www.ojk.go.id/id/regulasi/Documents/Pages/Peraturan-Bank-Indonesia-Nomor-625PBI2004/316.pdf', 'page_number': 16}\n \n- 16 -\nPasal 31 \nDengan diberlakukannya Peraturan Bank Indonesia ini maka Surat Keputusan \nDireksi Bank Indonesia Nomor 27/117/KEP/DIR tanggal 25 Januari 1995 \ntentang Penyampaian Rencana Kerja Bank dan Laporan Pelaksanaannya dicabut \ndan dinyatakan tidak berlaku, kecuali ketentuan Pasal 6, Pasal 7, dan Pasal 8 \ntetap berlaku sampai dengan berakhirnya masa pelaporan realisasi dan \npelaksanaan Rencana Kerja Tahunan tahun 2004. \n \nPasal 32 \n(1) Ketentuan dalam Peraturan Bank Indonesia ini mulai diberlakukan untuk \nRencana Bisnis tahun 2005. \n(2) Peraturan Bank Indonesia ini mulai berlaku sejak tanggal ditetapkan. \n \nDitetapkan di Jakarta""
 ""metadata={'title': 'Peraturan Bank Indonesia Nomor 6/22/PBI/2004', 'sector': 'Perbankan', 'subsector': 'Bank Umum,  BPR', 'regulation_type': 'PPBI', 'regulation_number': '6/22/PBI/2004', 'effective_date': '9 Agustus 2004', 'file_url': 'https://www.ojk.go.id/id/regulasi/Documents/Pages/Peraturan-Bank-Indonesia-Nomor-622PBI2004/324.pdf', 'page_number': 63}\n \n- 4-\nAngka 12 \nCukup jelas. \nAngka 13  \nCukup jelas. \nAngka 14 \nKetentuan ini dimaksudkan agar anggota dewan \nKomisaris secara sungguh-sungguh melaksanakan \nfungsinya dalam mengawasi BPR. \nAngka 15 \nCukup jelas. \nHuruf d \nAntara lain meliputi bagan organisasi, garis tanggung jawab \nhorizontal dan vertikal, serta jabatan paling rendah sampai \ndengan tingkatan Pejabat Eksekutif. \nHuruf e \nCukup jelas. \nHuruf f \nCukup jelas. \nHuruf g \nContoh penulisan keterangan atas setoran modal pada bilyet \ndeposito adalah “Dewan Gubernur Bank Indonesia  qq. Sdr. \n‘A’ untuk pendirian PT BPR ‘XYZ’ ”. \nHuruf h …""]",Peraturan Menteri Keuangan Nomor 36/PMK.010/2008.,1.0,0.9753814856513597,0.0,0.0,0.871330321017262,0.2178325802543155,0
Kapan dan dimana peraturan tersebut ditetapkan?,"Peraturan Menteri Keuangan Nomor 36/PMK.010/2008 tentang Besar Santunan dan Sumbangan Wajib Dana Kecelakaan Lalu Lintas Jalan ditetapkan pada tanggal 26 Februari 2008 di Jakarta.

Source: [36/PMK.010/2008](https://www.ojk.go.id/id/regulasi/Documents/Pages/PMK-Nomor-36PMK.010-Tahun-2008-tentang-Besar-Santunan-dan-Sumbangan-Wajib-Dana-Kecelakaan-Lalu-Lintas-Jalan/menas13_1389258036.pdf)","['MENTERI KEUANGAN\nREPUBLIK INDONESIA\nSALINAN\nPERATURAN MENTERI KEUANGAN\n36 /PMK.010/2008\nNOMOR\nTENTANG\nBESAR SANTUNAN DAN SUMBANGAN WAJIB\nDANA KECELAKAAN LALU LINTAS IALAN\nMENTERI KEUANGAN\nMenimbang : a. bahwa untuk memenuhi kecukupan sosial (social adequacy) dalam\npemberian perlindungan dasar kepada masyarakat yang menjadi\n kecelakaan alat angkutan lalu-lintas\nkorban\nmeningkatkan\n besar santunan dengan mempertimbangkan\npeningkatan kebutuhan hidup dan tingkat inflasi;\nb. bahwa sehubungan dengan huruf a tersebut, perlu melakukan\npenyesuaian terhadap ketentuan yang mengatur mengenai besar\n bahwa berdasarkan pertimbangan sebagaimana di maksud dalam\n huruf a dan huruf b, perlu menetapkan Peraturan Menteri Keuangan\ntentang Besar Santunan dan Sumbangan Wajib Dana Kecelakaan\nLalu Lintas Jalan;\nMengingat\nLalu Lintas Jalan (Lembaran Negara Republik Indonesia Tahun 1964\nNomor 138, Tambahan Lembaran Negara Republik Indonesia\nNomor 2721);'
 'REPUBLIK INDONESIA\n Penyelenggaraan Usaha Perasuransian (Lembaran Negara Republik\nIndonesia Tahun 1992 Nomor 120, Tambahan Lembaran Negara\nRepublik Indonesia Nomor 3506) sebagaimana telah diubah dengan\nPeraturan Pemerintah Nomor 63 .Tahun 1999 (Lembaran Negara\nNegara Republik Indonesia Nomor 3861);\n Keputusan Presiden Nomor 20/P Tahun 2005j\n Keputusan Menteri Keuangan Nomor 337/KMK.011/1981 tentang\nPenunjukan Perusahaan Perseroan (Persero) Asuransi Kerugian Jasa\nRaharja untuk\n menyelenggarakan Dana Pertanggungan Wajib\nKecelakaan Penumpang dan Dana Kecelakaan Lalu Lintas Jalan;\nMEMUTUSKAN:\nMenetapkan : PERATURAN\nMENTERI\nKEUANGAN\nTENTANG\nBESAR\nLALU LINTAS JALAN\nPasal 1\n(1) Sumbangan Wajib Dana Kecelakaan Lalu Lintas Jalan,\nselanjutnya\n disebut SWDKLLJ, adalah sumbangan\nwajib\nsebagaimana dimaksud dalam Undang-Undang Nomor 34 Tahun\n1964 tentang Dana Kecelakaan Lalu Lintas Jalan juncto Peraturan\nPelaksanaan Dana Kecelakaan Lalu Lintas Jalan.'
 'MENTERI KEUANGAN\nREPUBLIK INDONESIA\nPasal 7\nDalam hal Pemerintah Daerah melakukan pembebasan terhadap Pajak\nperusahaan yang ditunjuk untuk menyelenggarakan Dana Kecelakaan\nLalu Lintas Jalan dapat menetapkan kebijakan pembebasan pembayaran\nSWDKLLJ, Kartu Dana/Sertifikat, dan besar denda SWDKLLJ yang\ntertunggak untuk tahun yang lewat, dengan mempertimbangkan\nkebijakan Pemerintah Daerah setempat.\nPasal 8\nPada saat Peraturan Menteri Keuangan ini mulai berlaku, Keputusan\nMenteri Keuangan Nomor 416/KMK.06/2001 tentang Penetapan\nSantunan dan Sumbangan Wajib Dana Kecelakaan Lalu Lintas Jalan,\ndicabut dan dinyatakan tidak berlaku.\nPasal 9\nPeraturan Menteri Keuangan ini mulai berlaku setelah 30 (tiga puluh\nhari sejak tanggal ditetapkan.\nPeraturan Menteri Keuangan ini dengan penempatannya dalam Berita\nNegara Republik Indonesia.\nDitetapkan di Jakarta\npada tanggal 26 Februari 2008\nMENTERI KEUANGAN\nttd\nSalinan sesuai dengan aslinya\nSRI MULYANI INDRAWATI\nn Tata Usaha Departemen'
 'wajib\nsebagaimana dimaksud dalam Undang-Undang Nomor 34 Tahun\n1964 tentang Dana Kecelakaan Lalu Lintas Jalan juncto Peraturan\nPelaksanaan Dana Kecelakaan Lalu Lintas Jalan.\n2) SWDKLLJ merupakan premi asuransi yang dibayarkan oleh para\npengusaha/pemilik alat angkutan lalu lintas jalan kepada\nperusahaan yang menyelenggarakan Dana Kecelakaan Lalu Lintas\nJalan.\nPasal 2\n(1 Korban kecelakaan alat angkutan lalu lintas jalan atau ahli warisnya\nberhak atas santunan.\nBesar santunan sebagaimana dimaksud pada ayat (1) ditentukan\nsebagai berikut:'
 'waktu 30 (tiga puluh) hari sejak berlakunya peraturan dimaksud dengan menggunakan\nFormulir Nomor III.B.2-6 lampiran 6 peraturan ini.\nDitetapkan di      :   Jakarta\nPada tanggal      :   17 Januari 1996\nBADAN PENGAWAS PASAR MODAL\nKetua,\nI PUTU GEDE ARY SUTA\nNIP. 060065493\nLAMPIRAN\nK e p u t u s a n  K e t u a  B a d a n\nP e n g a w a s  P a s a r  M o d a l\nNomor \n:\nKep- 08/PM/1996\nTanggal\n:\n17 Januari 1996'
 'AEPUBLIK INDONESIA\nPasal 8\nPersyaratan dokumen fotokopi tanda bukti kelulusan penilaian\nkemampuan dan kepatutan sebagaimana dimaksud dalan Pasal 3 ayat\npendiriannya disahkan sebelum tanggal 12 Februari 2011.\nBAB V\nKETENTUAN PENUTUP\nPasal 9\nPada saat Peraturan Menteri Keuangan ini mulai berlaku, Keputusan\nMenteri Keuangan Nomor 228/KMK.017/1993 tentang Tata Cara\nPermohonan Pengesahan Pendirian Dana Pensiun Lembaga Keuangan\ndan Pengesahan Atas Perubahan Peraturan Dana Pensiun dari Dana\nPensiun Lembaga Keuangan sebagaimana diubah dengan Keputusan\n Menteri Keuangan Nomor 802/KMK.01/1993, dicabut dan dinyatakan\nPasal 10\ndiundangkan.\nAgar setiap orang mengetahuinya, memerintahkan pengundangan\nPeraturan Menteri Keuangan ini dengan penempatannya dalam Berita\nNegara Republik Indonesia.\nDitetapkan di Jakarta\npada tanggal 7 Februari 2011\nMENTERI KEUANGAN,\nttd.\nDiundangkan di Jakarta\nPadatanggal 7 Februari 20ll\nAGUS D.W. MARTOWARDOJO\nMENTERI HUKUM DAN HAK ASASI MANUSIA\nPATRIALIS AKBAR']",26 Februari 2008 di Jakarta.,1.0,0.8527126314605952,0.999999999975,0.75,0.8075101190621186,0.5768775297655296,0
